rating_id,customer_id,restaurant_id,order_id,rating,review,rating_date
1,748,196,9469,2,Candidate debate establish officer.,2023-06-14
2,307,237,6766,5,Black million follow field among decide image maintain.,2024-05-09
3,21,216,8460,1,Up lawyer arrive teach high brother.,2024-01-21
4,485,452,9641,1,After baby me lay off sound.,2023-12-15
5,743,474,7131,1,Month sort onto well crime federal.,2024-04-07
6,328,104,3830,3,Reach discuss hair that same forward.,2024-05-07
7,296,347,8793,2,Room there sing suffer rather pull.,2023-01-29
8,348,233,7150,4,Late our information.,2024-09-24
9,813,93,874,5,Sure site believe development inside wish.,2024-11-19
10,917,377,1824,1,Better war significant reveal wish well become.,2024-07-10
11,15,411,6584,4,Cut fly a back risk often gas.,2024-02-15
12,390,230,7370,3,Road but maybe five experience.,2024-01-05
13,436,27,8017,5,Future while listen purpose music hand.,2023-06-08
14,835,256,6052,5,Become store major even whom.,2024-08-23
15,980,483,426,3,Structure end early.,2023-07-19
16,456,357,9448,5,Idea raise above be financial rather.,2024-12-22
17,489,282,4913,5,One our simply compare.,2023-12-12
18,20,85,2654,4,Congress effort girl cause top close send.,2023-12-25
19,521,284,4706,5,You outside home without.,2023-11-26
20,182,159,3133,5,Less board put pull.,2024-06-04
21,779,135,796,4,Line material collection exist spend capital wife.,2023-12-21
22,646,477,7377,2,Product would begin particular.,2023-10-07
23,81,493,8873,2,After pretty total involve hospital.,2023-09-24
24,595,244,9669,3,Camera different from himself.,2024-05-29
25,723,408,5130,3,Floor others factor compare morning test mouth lawyer.,2023-01-13
26,589,140,3100,2,Matter want leave play.,2024-03-28
27,342,221,4602,5,According result health woman large successful training.,2023-04-07
28,464,480,1861,2,Walk do garden pass budget run.,2023-05-06
29,232,329,2317,5,Cost act organization nature.,2023-01-15
30,834,127,5429,3,Loss maintain join.,2024-07-15
31,600,482,4208,5,General page blue establish without college wife.,2024-10-26
32,29,304,7713,2,Analysis war century record.,2023-11-08
33,674,351,1014,1,Contain your TV hour after chance.,2024-01-16
34,818,481,5496,3,Child but early growth show.,2024-06-09
35,369,455,3656,5,Month not computer he anyone ago stop.,2023-06-27
36,566,130,1536,4,Well want herself kid police father provide.,2024-05-09
37,772,19,134,3,Stuff myself also could heart.,2024-08-30
38,445,395,5345,1,Standard offer poor organization fill yard century source.,2023-08-23
39,890,256,3190,1,Sign read growth hear best far night it.,2024-01-07
40,395,495,2045,5,Structure agreement red rather.,2023-09-08
41,272,342,9720,2,Benefit accept development ability wonder indicate value.,2024-03-05
42,822,489,8833,1,Air subject majority line appear hit.,2023-11-20
43,796,253,8557,1,Should force move claim wife.,2023-11-19
44,829,443,8989,1,Final large condition maintain series.,2024-05-28
45,676,26,2915,2,Article pick help course baby themselves popular table.,2023-09-25
46,213,235,6033,3,Development local tell choose history.,2024-12-13
47,605,232,6863,1,Particularly experience say strategy each indeed wind.,2023-05-22
48,323,340,1338,3,Situation home owner central owner around such.,2024-02-23
49,558,173,1596,2,Student moment free agency.,2024-11-16
50,800,225,2344,3,Medical why else minute music.,2024-12-25
51,400,116,3727,5,For give increase lawyer mean itself.,2024-05-17
52,35,174,6584,1,Family operation politics take final stay whole.,2024-11-05
53,29,191,7543,5,Service officer environmental truth throw include message.,2023-09-07
54,409,311,7383,2,Describe treat series few future others human stand.,2023-06-26
55,309,198,3576,1,Front anyone ahead.,2024-08-14
56,193,92,1975,3,Charge service Mrs international suggest interesting interest suffer.,2024-07-02
57,649,250,5640,5,Maintain moment drive one a Democrat cut.,2023-03-21
58,82,394,6966,1,Measure because offer question possible collection.,2024-08-05
59,9,378,4768,4,Discussion Republican water Congress American.,2023-07-28
60,965,500,5246,1,Or guess than church.,2023-11-08
61,443,289,13,4,Participant spend direction car.,2023-11-14
62,919,494,4686,2,Beat sea national.,2023-06-18
63,247,18,6549,3,Ability relate arrive middle.,2023-08-25
64,863,90,2390,4,Themselves parent consumer student.,2024-07-20
65,667,276,6012,4,Eye meet down myself accept hit.,2023-01-15
66,952,186,6181,5,Huge above reduce information country professor.,2024-04-29
67,845,122,8481,5,Image nice wonder group table capital process.,2023-09-28
68,481,26,7191,5,Material cold some kind and foot boy.,2024-05-13
69,942,435,3031,1,Democrat something whom table.,2023-04-19
70,26,148,1833,2,Third paper when attorney particular.,2023-04-11
71,539,412,7055,4,Draw where pull wife feeling answer.,2024-06-04
72,717,354,9749,4,Effect middle movement nearly yes enjoy land rule.,2023-07-23
73,842,173,9003,3,Kitchen for so sea.,2024-06-25
74,495,459,4943,4,Expect game four meet.,2024-09-06
75,2,229,6463,4,Thing necessary those long.,2023-07-19
76,620,276,4422,2,On rather evening.,2023-03-11
77,994,210,2150,4,Office color might throughout study try.,2023-12-27
78,702,220,2881,1,Course exist because tough growth rule term.,2024-07-30
79,37,338,1627,4,Without no example red drug ground.,2023-01-18
80,616,223,4265,4,Term half nice chair friend interest black.,2024-05-05
81,894,463,8716,3,Pay necessary top fund fly.,2023-02-27
82,958,313,2987,5,Simple threat reveal physical.,2023-10-10
83,248,374,4559,5,Likely kitchen federal can serve.,2023-08-14
84,239,383,9318,2,Chair society almost every country statement.,2024-03-28
85,512,150,5508,3,Physical surface them deal case full nothing.,2023-01-13
86,234,471,6035,5,Month determine result country take fish risk computer.,2023-11-19
87,293,266,665,4,At everyone common company support.,2023-01-23
88,563,381,4947,4,Energy fill series.,2023-11-14
89,942,329,7029,1,Politics usually try how Mr happy.,2024-02-14
90,52,10,7205,4,Well remain no major read might.,2023-01-15
91,468,87,5927,1,Option force shake apply brother southern.,2024-08-13
92,575,222,9811,1,Positive line already believe.,2024-03-06
93,69,412,5559,4,Sing in financial medical.,2023-04-10
94,857,475,8934,3,Business political majority help answer discover.,2023-06-09
95,902,177,4315,4,Protect wear nice.,2024-02-10
96,711,420,7672,2,Say help test world line on none sound.,2024-04-26
97,525,187,4222,1,Raise maybe surface camera.,2024-03-06
98,355,490,1668,4,Affect central my everybody eye.,2024-03-14
99,877,209,8099,5,Together professional yes father marriage their.,2023-03-24
100,580,345,6885,5,Meeting east deep bad.,2024-04-06
101,184,240,9065,4,If himself rule at.,2023-01-28
102,75,7,1899,3,Its serious program know individual grow strong.,2024-05-21
103,99,153,1324,2,Main common card stop western order story.,2024-12-14
104,636,183,1137,1,Its risk growth war author add.,2023-09-03
105,685,247,7612,3,Social sort fine important everybody enjoy wait sell.,2024-03-01
106,403,200,5173,5,Environmental keep make win my.,2023-12-20
107,136,159,6235,4,Address thing fill institution nor game short.,2024-10-20
108,249,449,8953,2,Argue consider special past arrive.,2023-01-13
109,909,479,714,3,Give church born travel.,2024-06-24
110,828,227,9620,4,Only between foreign building smile medical.,2024-11-14
111,296,27,3464,5,Food finish heart stage beautiful become attorney to.,2024-10-07
112,189,102,9492,4,Guy animal reflect chance.,2024-09-14
113,771,184,811,1,Finally together especially phone box degree until realize.,2023-12-31
114,421,243,8266,3,Fund growth none give staff building believe.,2024-01-30
115,417,264,720,3,Single course ball.,2023-02-21
116,80,300,7881,4,Something would commercial land.,2024-04-27
117,461,46,4297,3,Perform allow community least take paper.,2023-12-21
118,671,350,7942,5,Research so environmental skill.,2023-04-07
119,21,415,6470,3,Fine difficult last under four so worker.,2023-01-12
120,444,295,813,3,Fly gun do ahead edge cut.,2024-02-06
121,34,63,5293,1,Sound in perform cost.,2024-08-15
122,970,8,5888,3,Follow when push structure care suddenly.,2024-06-06
123,208,378,6695,5,Resource real campaign level miss understand somebody police.,2023-03-21
124,542,62,1399,5,Little democratic campaign let.,2023-07-03
125,534,231,3080,3,Control call often easy also.,2023-11-15
126,541,195,7529,3,Sometimes certain detail put wind ahead.,2024-02-14
127,955,95,199,4,Matter authority relationship player.,2024-05-22
128,460,316,4396,4,His view management economy establish before.,2024-04-20
129,648,146,5626,4,When its move type play space civil.,2024-10-13
130,237,194,9787,4,Herself hundred question that interesting among talk sister.,2023-08-09
131,470,9,7898,3,Necessary early show that consumer foreign compare night.,2024-07-01
132,190,309,7476,5,Deal treatment economic off action where well.,2023-04-01
133,544,366,9117,4,Management almost consider around within.,2023-02-16
134,484,28,6316,1,Which fear must bad statement.,2023-02-05
135,277,23,1645,4,Without officer truth.,2024-01-05
136,838,343,5545,2,Since nothing rest down grow poor own window.,2024-07-21
137,902,79,86,3,Green pretty out.,2023-06-16
138,937,329,1271,1,Various consumer professional treatment maintain speak total.,2024-08-12
139,816,481,3456,2,Room process follow and pattern size.,2023-04-25
140,988,493,1105,3,Democratic report record clearly price capital.,2023-03-21
141,665,428,5621,1,Director drop pattern continue common as.,2023-08-08
142,474,32,3779,1,Past development crime build old one they strategy.,2023-11-01
143,917,170,9905,5,Others fight return throw voice.,2024-10-23
144,17,66,4207,5,Relate kitchen charge.,2024-12-04
145,525,245,5874,2,Public detail actually street.,2023-11-10
146,190,100,2906,5,Imagine on stand.,2024-07-08
147,159,235,9609,5,Will suffer piece mission realize box.,2024-09-06
148,950,419,1963,4,Challenge statement under mind.,2023-10-04
149,433,195,5583,5,Window factor talk commercial community doctor.,2024-06-18
150,466,276,785,4,Name present region test.,2023-12-16
151,44,110,1895,1,Law long nice walk write.,2024-10-27
152,820,122,1692,1,Statement use degree.,2023-10-30
153,936,320,1948,4,Day section find whatever practice.,2023-06-17
154,618,148,563,3,Money gas physical other reflect local.,2023-02-27
155,647,373,1861,1,Last sell maintain now old.,2023-07-05
156,206,486,8988,3,Home firm step same stage few.,2024-11-13
157,607,102,7975,3,Congress agency hope figure source wrong knowledge mean.,2024-10-25
158,254,401,6636,1,Name husband situation campaign establish.,2024-04-12
159,372,346,6979,4,Reveal type able perhaps.,2024-08-11
160,238,305,2846,5,Not democratic sister.,2023-04-05
161,285,33,1373,3,Attorney vote interest play worker sing executive.,2023-08-09
162,527,41,8402,3,Land option nation dinner standard.,2024-11-23
163,125,177,5068,3,Democratic thus cold bag deal born.,2023-03-02
164,909,313,8247,1,Might social white along new.,2024-02-13
165,17,274,8815,4,Give impact happen follow suffer article.,2024-07-15
166,939,462,803,1,Short management arm piece area crime.,2024-04-29
167,519,246,2970,5,Picture miss live.,2024-07-19
168,384,107,2606,5,Choose all wife.,2024-03-08
169,850,449,9092,4,Win total outside his way meet.,2023-05-24
170,860,140,1530,3,Medical within beautiful these.,2024-08-24
171,422,402,7201,2,May everyone mother peace offer today.,2024-10-03
172,941,433,6452,4,Yard paper up common.,2023-06-22
173,127,140,5723,4,Room camera eight although son.,2023-02-04
174,256,204,6693,2,Floor threat community newspaper which live.,2024-09-08
175,803,341,4699,3,Similar marriage everything decision.,2023-10-16
176,856,463,8143,5,Remember community seek.,2023-03-19
177,127,395,1363,3,Environment moment occur land.,2023-06-26
178,970,163,103,3,Turn sister for discussion speech daughter lay.,2024-12-25
179,58,336,1396,1,Compare job fight suffer play herself later rock.,2024-05-28
180,377,242,2989,2,Before control be more program research.,2023-11-24
181,672,476,2058,3,State quite customer great such even.,2023-11-16
182,719,344,9349,4,Because economy bar.,2023-01-27
183,624,88,3868,5,Certainly language improve successful service fly certain.,2023-02-02
184,807,408,5901,1,Painting most thus.,2024-12-06
185,286,231,8673,4,Central population him mention region western.,2023-05-17
186,347,184,4256,5,Hour turn window walk toward.,2023-06-08
187,978,183,6023,4,Campaign detail from behind.,2024-04-17
188,694,18,603,1,Data challenge water artist term.,2024-11-04
189,7,431,8256,1,Indeed off specific degree play short see particular.,2024-03-22
190,611,408,836,1,Owner every consider.,2023-08-27
191,368,72,3812,3,Create opportunity reason understand record.,2024-09-03
192,854,83,700,5,Model report sea group.,2023-10-03
193,942,159,3588,5,Process this officer fly available car attack card.,2024-08-31
194,672,160,3499,1,Lawyer ready film upon trade hit economy kind.,2023-02-15
195,907,254,3358,4,Item agent fact too they.,2023-10-06
196,463,490,7603,5,Then spring film medical road but.,2023-11-16
197,421,168,1293,5,Education ever entire low.,2023-07-07
198,850,100,735,4,Poor risk visit center method dog.,2023-10-25
199,722,71,2581,1,Mrs hour range reason difficult win well.,2023-10-25
200,507,365,647,2,Fast late ok pick past part lead.,2023-05-06
201,587,448,4783,1,Business eye individual Congress several.,2023-03-17
202,696,157,6262,1,Resource charge red career well who.,2024-10-04
203,214,173,6994,5,Else positive poor test occur many.,2024-09-05
204,569,3,4429,3,Board pretty first general specific hit.,2024-07-20
205,734,61,3706,5,American ask exactly not until involve.,2024-06-24
206,180,301,1963,1,Body a teacher realize sometimes information research truth.,2023-08-21
207,803,357,5981,1,Age step grow college experience.,2023-06-06
208,546,83,4484,5,Ready the election product hour.,2023-10-01
209,189,236,4423,2,Foot skin task.,2024-11-14
210,14,321,8121,2,Management nation attack indeed use serious.,2023-05-16
211,656,49,5318,1,Night kitchen threat capital dinner Democrat economic.,2024-06-07
212,636,55,9739,4,Risk politics attack information article.,2023-07-04
213,693,417,2313,5,Together family work address improve.,2023-01-02
214,609,397,6207,5,Maybe special break pull police city there right.,2024-11-13
215,559,400,8753,3,Person ok bad nor.,2023-11-15
216,761,94,7265,2,Wife food certainly.,2024-06-17
217,332,471,3573,1,Fall appear body design.,2023-04-16
218,862,200,2501,5,Help at half beyond hospital.,2024-10-29
219,602,304,9036,3,Machine education difficult value laugh about too big.,2024-07-17
220,100,158,9466,2,Product involve several store suddenly my artist.,2023-03-20
221,507,8,8846,5,Authority citizen sign early.,2023-09-25
222,464,393,71,3,Establish new policy wife face.,2024-07-07
223,167,463,169,3,Clearly professional cold woman back.,2023-09-25
224,317,385,4551,1,Us eye serious hair gas.,2023-02-24
225,548,135,5303,4,Career sell financial material quality Democrat floor.,2023-03-05
226,261,263,3986,5,Whom wear father do question mind green give.,2024-06-28
227,262,42,9979,1,Believe outside stop five green.,2024-11-23
228,739,407,3586,1,Town within study wind defense democratic out.,2023-06-04
229,572,241,6013,3,Statement day out look.,2023-08-06
230,474,14,7897,5,Low act field part.,2024-07-17
231,903,108,9393,2,Answer into soon ago probably very billion will.,2024-04-02
232,561,315,376,5,Wear challenge store girl dark cost.,2024-08-19
233,285,219,2464,5,Mr off large relationship task which.,2024-12-28
234,947,76,1036,4,Despite end structure page.,2023-06-28
235,341,88,9926,1,Recognize current wonder leg fish far site.,2023-06-19
236,955,148,3769,4,Quickly represent cover list second.,2023-01-30
237,526,413,3040,2,Make right eight chair total agreement near.,2023-12-16
238,354,275,767,2,Rate thank glass special at.,2023-01-03
239,852,113,8660,1,Physical standard event could along.,2024-07-04
240,635,251,2814,3,Common ahead despite majority real lose.,2023-06-12
241,576,161,4389,2,Then of whatever lead amount.,2024-01-14
242,930,87,4707,4,So case hand administration.,2023-02-21
243,161,437,5782,1,Man simply certain role west.,2023-11-27
244,979,414,1511,3,His choice with you rather.,2023-03-22
245,391,319,2932,3,Debate happen young little hour billion speech.,2023-03-02
246,715,468,5024,4,Peace stock mention himself.,2023-10-15
247,856,175,2101,4,Could live design sing executive fill same others.,2023-12-12
248,57,491,5213,5,Population future management listen add probably.,2024-11-28
249,615,101,654,2,Themselves from once professor memory blue.,2023-04-16
250,829,83,1882,1,Item them guy.,2024-03-29
251,326,33,5032,2,Much sing build street.,2023-01-07
252,958,461,7950,3,Money central card computer source.,2023-07-12
253,733,421,6743,5,Science stay recent fund.,2023-05-22
254,367,364,2559,3,Really late machine enjoy police eat.,2024-08-02
255,328,423,282,5,Decision college character.,2024-08-04
256,158,221,1688,3,Production most stock pay only.,2023-08-27
257,603,383,219,3,Remain line protect fly rather piece.,2024-05-08
258,8,471,6023,5,Try man make understand term out.,2024-05-06
259,841,136,4448,3,Hold administration political.,2023-04-28
260,887,473,5169,1,Home green drop store.,2023-10-19
261,807,199,9906,2,Kind why seek room night fill.,2024-02-16
262,839,282,669,5,Piece for board phone sell.,2024-11-22
263,872,104,8507,4,Individual week what good order trouble choice child.,2023-05-13
264,726,276,2398,2,By nor guess wall financial authority party.,2024-05-01
265,808,300,8850,5,Stand machine win serious east draw.,2023-05-12
266,262,258,4554,4,Point them end more final eat eight home.,2024-04-08
267,685,322,6704,3,Glass report argue carry term.,2024-07-21
268,373,306,6161,3,Rock expect environmental sit.,2024-03-07
269,800,407,2904,4,Your Democrat development point always last.,2024-06-15
270,613,72,5697,3,Big responsibility ready fall.,2024-08-23
271,518,24,8729,3,Fire reflect allow if four.,2023-11-22
272,548,331,92,3,Culture group my look feeling.,2023-12-24
273,472,83,2065,2,Score purpose carry participant against appear science.,2024-08-15
274,793,219,8802,2,Window ok trouble speak.,2024-10-16
275,358,206,9102,5,He kind grow decide eye.,2024-08-07
276,803,313,9500,2,Help seven oil history billion mission.,2023-11-29
277,768,404,1413,2,Now Congress begin relationship realize form student.,2024-09-17
278,463,49,8195,3,Western run official stand believe new follow by.,2024-10-20
279,813,313,2864,3,Those pick go.,2024-01-02
280,253,39,4693,2,Brother become accept from.,2024-02-22
281,457,155,4316,4,Series cover allow make film behind movie.,2024-04-24
282,754,298,4771,1,And dark cut opportunity.,2023-01-06
283,266,458,4605,5,Simple particular fine.,2024-10-30
284,448,271,180,4,Fight process last better trouble since.,2024-01-17
285,881,235,3561,2,Certain whose well popular decade.,2024-08-13
286,676,317,5046,2,List might always create eat glass mother.,2024-07-07
287,616,470,1516,3,Actually answer every interesting.,2023-04-07
288,950,306,7681,3,Before institution measure value bag commercial.,2024-02-18
289,320,383,5500,1,Yard wish walk point garden.,2024-02-24
290,459,408,7949,5,Success dark several similar trial talk.,2023-04-08
291,635,307,3109,2,Simple man particularly Mrs mention including especially.,2023-08-11
292,383,328,9256,3,Look including certainly environmental.,2024-09-30
293,296,136,1039,5,Mission provide position join evidence over job.,2024-07-14
294,944,231,4019,2,Sense above quality pay.,2024-05-19
295,853,143,5550,2,Seem might break.,2023-07-08
296,863,102,5824,1,Every that real.,2023-10-21
297,96,482,4045,5,Center sense win wide knowledge program apply.,2024-12-22
298,244,347,8155,5,Executive nor science lay over.,2023-12-03
299,415,442,8829,5,Least around material defense half exist many.,2023-09-16
300,583,434,9461,4,Who black season relate everything.,2024-10-09
301,226,146,2025,5,Onto will which think quality.,2024-05-23
302,188,59,1627,2,Mean system hair rock hotel.,2023-02-10
303,848,464,4769,2,Area data difficult develop husband special.,2024-02-19
304,307,255,2408,3,Floor charge age.,2024-09-07
305,954,418,1298,4,First generation time keep modern affect.,2024-04-25
306,860,479,6426,1,Level white heavy up investment eye bring.,2024-05-29
307,34,67,5646,3,Employee us power actually.,2023-05-21
308,586,95,4308,2,Fire think wall a.,2024-01-29
309,703,282,1135,2,Interview industry local most test food.,2023-06-30
310,379,148,1221,2,Economic worker consider.,2023-12-22
311,741,50,7427,4,Young personal ground quite small others maintain.,2024-09-17
312,1,480,4709,4,Government then write international.,2023-04-27
313,62,186,1466,4,Land certainly across.,2024-02-24
314,19,434,776,5,Month explain receive pattern color few.,2023-01-06
315,119,374,811,1,Teacher sit college step more.,2023-07-22
316,494,268,5955,3,Learn bit guess me movement clear.,2024-08-24
317,174,199,6054,4,Spend even challenge.,2023-04-29
318,307,113,8409,1,Pretty reason somebody.,2024-04-02
319,877,481,5972,3,Rise nor perform population board role.,2023-03-10
320,180,15,8480,5,Image under box field perhaps generation.,2024-03-12
321,307,182,9311,2,Very look really political police finish technology.,2024-07-29
322,779,39,4268,4,Even feeling other trouble key.,2023-08-02
323,4,425,724,5,Whom type challenge prepare difference.,2024-10-21
324,661,471,3386,1,Should stand they picture discover.,2024-06-13
325,251,40,897,4,Direction student big program owner father.,2024-01-26
326,555,249,2821,4,Season same he protect seem thousand human hand.,2023-07-13
327,817,8,5925,5,Box Congress defense understand money.,2024-03-20
328,666,162,3604,2,Risk quite likely worry quality.,2024-12-01
329,209,278,2255,2,Gas outside form south me.,2024-03-02
330,721,212,1225,2,Them soon affect other.,2024-01-20
331,789,308,155,1,Approach him best able day space.,2023-06-07
332,756,222,5472,5,Story officer remain many learn market compare.,2024-07-27
333,275,200,9987,1,Get line take organization vote.,2023-12-06
334,11,241,7694,4,Quite young that these.,2023-05-28
335,900,443,3424,3,Product bad road operation.,2024-05-27
336,47,168,3577,3,Successful first TV east bill president able figure.,2023-08-12
337,592,116,9711,1,Hope southern war every.,2023-04-24
338,256,140,3568,5,Again much movement role oil.,2024-04-08
339,188,493,8870,1,Push best natural.,2023-02-18
340,979,199,6226,4,Spend his about either crime start.,2023-11-11
341,889,108,778,2,Yeah compare fly whole.,2023-10-09
342,163,264,8093,4,Respond building beat seat mean song yard.,2023-10-21
343,325,445,2807,2,Store must yet cost.,2024-11-06
344,396,278,3563,2,Draw after lot mouth marriage.,2023-07-15
345,783,323,5637,3,Alone begin environment receive on reason.,2024-01-11
346,490,365,1682,4,Important prevent kid let nice whatever.,2024-09-01
347,330,108,9343,3,Expert long dog chair scene war onto.,2023-05-31
348,595,418,8920,4,Art than few site.,2024-10-17
349,259,19,5300,2,Member hair field me.,2023-03-18
350,474,486,1054,5,Beautiful power lot.,2023-10-18
351,630,485,353,4,According exactly song walk traditional opportunity.,2024-03-18
352,251,466,3830,5,Lay buy traditional account.,2024-04-30
353,189,271,5554,1,Order trip mind every.,2023-03-06
354,247,392,8858,4,Campaign seek local once.,2023-05-04
355,445,336,360,3,Different actually second wait doctor.,2024-11-09
356,740,208,7226,3,Situation risk quickly sure it employee find.,2024-02-05
357,738,69,8410,1,Fly or lead third reflect.,2023-06-28
358,351,105,1570,5,Rise black day never perhaps condition parent.,2023-05-01
359,506,92,7918,3,Work her simply age.,2024-11-10
360,827,241,9117,2,Life such spend happen.,2024-12-01
361,897,315,7485,1,Safe red attack more believe while already.,2024-12-21
362,200,386,7836,3,Today husband girl worry carry.,2024-05-28
363,148,150,4594,5,Ability family science technology strategy within.,2023-12-12
364,111,96,5690,3,Today happen vote owner.,2024-06-02
365,612,312,242,5,Follow wind actually natural heart represent voice computer.,2023-10-31
366,359,427,2177,4,Culture receive capital require city could.,2024-09-26
367,949,484,9062,3,Foreign study truth discussion best sea interview Democrat.,2024-02-19
368,719,306,3726,2,Performance add old.,2023-11-02
369,475,175,8821,5,Teach hit little.,2024-04-22
370,736,477,7342,5,Scene offer impact size believe.,2023-02-04
371,702,444,4509,1,Necessary also tree bill from option type.,2024-10-17
372,353,8,9358,4,Difference and ahead yet consider before.,2024-05-06
373,70,21,2355,4,Guy high dream street.,2024-04-23
374,180,431,6432,5,Resource serve fill over pattern.,2024-10-02
375,989,58,1391,3,Boy already he task effect commercial three.,2024-06-02
376,27,177,8363,3,Whom drive prevent ask hit on.,2023-12-05
377,433,84,3568,4,Drive whether recognize design common yourself.,2024-11-13
378,87,140,1426,3,Condition beyond light treatment check.,2023-10-26
379,602,245,6314,4,Treatment agency state strategy travel.,2024-01-08
380,42,123,9948,2,Keep shake second even.,2024-07-22
381,677,68,9697,3,Way require security center.,2024-03-04
382,628,112,1998,5,Kid local decade gas sit though feel model.,2024-09-07
383,23,180,8271,5,Project chair alone friend.,2023-10-22
384,110,156,9570,3,Recently add information project blood century energy.,2023-04-16
385,75,478,9706,1,Seem hotel opportunity much.,2023-02-07
386,662,390,1194,2,Try writer approach read firm.,2023-11-15
387,606,353,9982,2,Necessary everybody important thank less member region.,2024-01-05
388,428,384,578,1,Administration culture trial common.,2023-09-25
389,295,371,5230,4,Drop since get behind drug trial.,2023-09-28
390,479,306,6276,5,Leave city despite prevent child worker either challenge.,2023-07-12
391,993,184,6278,1,Hard career care whatever.,2024-02-26
392,220,69,1211,3,Meet decide unit shake.,2023-12-27
393,7,342,6051,4,Money fall ground member during offer role town.,2023-05-09
394,550,294,1760,2,Wall pretty behavior continue summer economy admit.,2024-07-16
