rating_id,customer_id,restaurant_id,order_id,rating,review,rating_date
7691,208,248,3877,3,Fine common push any personal not.,2023-05-22
7692,611,473,8059,4,Car better modern onto might.,2024-05-31
7693,1000,72,7839,3,Determine term ball including nearly include throughout.,2023-08-02
7694,67,482,6718,4,Hard live rise end share each within his.,2023-10-06
7695,684,396,654,1,Purpose usually usually in.,2023-08-29
7696,882,196,6657,5,Act talk job both.,2023-03-26
7697,637,11,4587,1,Certainly fine fine sense occur.,2024-12-02
7698,507,43,9975,2,Fight seek every food whole affect.,2024-10-17
7699,615,142,4592,4,Daughter figure concern country organization.,2024-07-03
7700,268,259,4672,3,Type seek chance successful town concern.,2024-06-23
7701,762,121,8831,2,Process public argue school green community war.,2023-12-07
7702,530,435,2582,3,Drive rather attorney TV stuff term best than.,2024-06-09
7703,273,154,2639,2,Lot open four.,2024-03-28
7704,99,261,2922,1,Individual actually between news picture.,2023-01-25
7705,196,463,2210,4,No husband those imagine popular.,2024-08-06
7706,863,374,4551,2,Difference international officer example article cost.,2024-12-14
7707,998,326,5908,1,Responsibility mother suddenly food agreement life should.,2024-05-20
7708,965,102,1566,2,Street each shoulder population half PM.,2023-11-03
7709,335,305,9200,3,Behind four line reach.,2023-10-06
7710,117,169,8434,1,Whom road top senior.,2024-04-04
7711,164,10,9295,2,Bed left along couple read floor free people.,2023-09-24
7712,995,306,5134,5,Positive follow future large.,2023-08-29
7713,492,321,7288,5,Pull couple customer nor garden.,2023-03-18
7714,769,394,1463,5,Box simply rock house.,2024-06-01
7715,572,438,4642,5,Night meet contain much throughout.,2024-09-18
7716,863,128,2268,2,To drop claim new charge drop.,2024-03-21
7717,153,228,1493,5,Perform indeed should notice rather piece.,2024-09-23
7718,113,453,3719,1,Would down stop teach.,2023-03-28
7719,121,92,5474,3,Get significant charge information political same force.,2023-01-08
7720,784,401,2037,3,Different since anyone he.,2024-08-15
7721,562,15,9024,4,Wait possible understand down action.,2023-07-16
7722,117,216,1266,5,Area church paper resource.,2023-08-01
7723,932,332,1042,2,Happen Republican growth difficult civil program show.,2024-07-04
7724,943,40,176,4,Lead produce discuss most teacher offer.,2023-06-02
7725,292,193,5127,3,Book civil military some.,2023-11-30
7726,985,409,57,3,About lead through lot.,2024-11-15
7727,981,48,7121,4,Final maybe idea travel Mrs lawyer quality.,2023-06-29
7728,949,445,6983,4,Any son certain including.,2024-10-23
7729,740,305,436,1,Maintain next nor public wear out.,2024-05-03
7730,880,65,3827,5,Material billion main now west watch.,2023-12-01
7731,428,414,7791,1,Approach result bag them system.,2023-05-06
7732,331,12,1080,4,Story pay blue truth during national.,2024-01-16
7733,643,435,316,4,Class none wait past.,2023-05-24
7734,562,179,4787,1,Actually personal herself shake of create huge clearly.,2024-04-03
7735,850,357,6034,3,Mr white several begin.,2023-05-03
7736,353,117,7585,3,Once international girl.,2023-08-19
7737,668,436,8426,2,As if most type rule another order.,2023-07-28
7738,282,331,4523,2,Argue suggest recently point.,2024-08-18
7739,484,428,6308,3,It into admit more form then dinner.,2024-02-19
7740,766,283,2145,2,Trip middle their central experience cell.,2023-07-29
7741,441,440,1630,5,Lawyer cost thing have growth.,2023-12-24
7742,367,233,5468,1,Whatever many box.,2024-06-19
7743,861,6,4754,2,Agree view choose body walk citizen detail.,2024-08-30
7744,733,9,5081,3,Ball need four add song on despite.,2024-11-29
7745,315,446,262,5,Environmental action economic oil for office control yourself.,2023-02-14
7746,947,313,3996,4,Also think than senior kid.,2024-08-29
7747,261,321,8901,4,Onto color and beat central ok whatever break.,2023-08-20
7748,662,468,3284,2,Stock better keep year.,2023-10-25
7749,225,347,4690,4,Population concern subject material face budget economic.,2024-01-09
7750,93,163,8637,1,Interesting son appear safe dog.,2024-12-18
7751,698,34,2079,5,Brother above food lose.,2023-05-15
7752,994,336,3345,4,Best third will face safe.,2023-07-03
7753,988,252,5962,1,Political former hope.,2023-05-29
7754,483,243,4976,5,Bag production before fund treat whose idea attack.,2024-11-26
7755,56,438,1217,4,Hold that else talk.,2023-07-23
7756,844,101,571,2,Service western design citizen common who more heart.,2024-04-11
7757,960,331,6982,4,Per thing identify together forward.,2023-12-11
7758,577,148,1199,1,Major until mind and thing.,2023-12-03
7759,12,160,8866,5,Good force family budget.,2024-05-03
7760,332,99,5239,4,Amount believe action lose.,2024-05-05
7761,280,436,254,4,Great real dinner organization.,2024-05-15
7762,275,440,8004,3,Whatever one argue seven husband hold.,2023-11-21
7763,490,213,2126,1,Since relationship arrive while house current where hot.,2024-09-13
7764,156,115,8021,2,Well here kid reason dark evidence.,2024-02-26
7765,592,108,6839,2,Former her nature investment role standard certainly buy.,2024-09-12
7766,521,244,1640,1,Watch forward song ever service wall child.,2023-08-05
7767,999,175,4037,4,Require animal field discussion.,2023-07-22
7768,9,430,8656,4,Age professional value.,2023-08-12
7769,446,53,3610,5,Keep hotel seem natural pay capital right themselves.,2024-08-09
7770,663,267,8697,3,House former decide.,2023-09-13
7771,470,127,1235,1,Cultural network part note project.,2024-08-25
7772,862,326,193,2,Again respond feeling next present religious sometimes.,2024-09-09
7773,907,3,7650,4,Energy drop often wall during ask.,2024-12-28
7774,172,484,7143,3,Can director off soon.,2023-01-05
7775,182,20,7738,4,Stage total even position.,2023-02-16
7776,327,233,5141,1,Health economic important star street.,2024-07-15
7777,521,155,7258,5,Age star business material thousand.,2024-02-23
7778,610,300,3801,2,Write throughout win.,2023-01-06
7779,128,235,8623,4,Wear government financial drive together positive.,2023-10-18
7780,482,208,5270,2,Wide fly this hit wonder matter study.,2024-01-22
7781,10,246,5252,1,Season above option thought must loss subject.,2024-11-19
7782,972,76,8514,1,Leader young media check time institution.,2024-09-04
7783,304,165,4784,2,Put inside book discover leg.,2024-01-22
7784,170,99,1154,2,Defense thousand hold lay former behavior lay ten.,2024-11-18
7785,857,160,7022,3,Third over compare today bag.,2023-06-22
7786,525,85,2007,4,Want one western charge site follow.,2024-05-29
7787,722,499,1434,1,Hard first rule must current.,2023-09-09
7788,604,18,7382,5,Couple left write write building it follow network.,2024-06-11
7789,558,245,9557,3,Practice task either among claim memory indicate.,2023-12-02
7790,388,463,3979,3,Produce choose suddenly.,2023-10-15
7791,510,259,7304,3,Above yourself design.,2024-01-14
7792,886,214,4163,5,Pick job production recent become unit man.,2023-06-09
7793,906,174,4929,1,Reveal only to scientist child subject citizen.,2024-11-17
7794,576,39,1394,5,Industry skill movement foreign trouble improve factor.,2023-01-24
7795,844,485,2017,3,When side news I sign.,2023-03-03
7796,535,26,3440,1,Across human Mrs already miss.,2023-06-24
7797,723,11,6702,5,Generation garden economic about window our.,2023-02-10
7798,873,90,287,5,Open long suggest tax front property.,2024-01-08
7799,505,231,4344,4,Hour foot research good I eye surface.,2023-09-01
7800,982,353,6138,5,Agency wish score tough room as.,2023-12-09
7801,664,220,1399,4,Animal write data serious.,2023-06-11
7802,425,126,6774,4,Open success social prevent commercial role.,2023-09-25
7803,716,486,972,4,Baby air campaign.,2023-10-06
7804,120,273,3369,5,Ask without back middle statement former report.,2024-12-30
7805,834,33,8112,1,Young read on record.,2024-04-06
7806,58,424,7294,1,Either agent force billion factor.,2023-06-08
7807,854,127,1728,1,Ago painting pressure analysis hit western listen notice.,2023-05-19
7808,927,267,6803,5,Idea hotel film speak industry.,2024-06-26
7809,791,26,1128,2,Five cold type close public western.,2023-07-22
7810,949,61,2267,4,Fill worry community military.,2024-04-25
7811,395,15,8681,5,Data art cultural training reflect stand quite.,2024-08-14
7812,778,479,223,2,Suddenly few green beautiful perhaps.,2023-06-26
7813,153,299,1233,4,Avoid near attack degree build always.,2024-03-19
7814,290,365,7836,1,Even tonight simply design laugh production budget.,2023-05-19
7815,358,449,8420,2,Animal under claim blue quite.,2024-06-14
7816,50,217,6385,4,Impact scientist step a range far.,2024-03-17
7817,557,103,7007,1,Improve song hit study across.,2023-02-26
7818,417,392,9990,2,Need effort rise wall case billion.,2024-07-08
7819,354,390,444,4,This direction often man may.,2024-01-19
7820,568,214,171,2,Many grow official character.,2024-12-27
7821,47,214,2044,1,Blue would shoulder social improve fast day yard.,2024-07-09
7822,962,227,9142,4,Third protect cold artist.,2024-01-15
7823,884,358,3533,5,Difficult language civil officer.,2023-07-19
7824,231,221,2072,5,Before if above top everybody process explain.,2024-09-10
7825,532,326,8255,2,Break seat clear stand daughter thought involve.,2024-08-07
7826,80,369,8869,2,City level perform huge open.,2024-04-27
7827,23,197,6533,3,Produce worry her without drop space.,2023-01-20
7828,117,130,7035,3,Statement mean number morning between deal any.,2023-03-06
7829,1,355,1329,1,Much listen ahead smile.,2023-09-15
7830,350,360,1880,2,Republican much easy message research remain skill.,2024-09-04
7831,42,80,7108,2,Discussion thank relationship reality not.,2024-06-23
7832,598,33,7907,2,Least station green which.,2024-10-22
7833,537,407,286,3,Girl story natural weight media before.,2024-01-11
7834,411,446,9709,3,Growth only form couple less.,2023-01-03
7835,48,256,668,3,Peace medical discuss however nearly mission start.,2023-10-03
7836,137,341,7741,4,Blood American data short none wear.,2023-02-28
7837,403,65,9414,1,Stage market father north far.,2024-11-13
7838,119,262,7682,2,Ball ok try buy.,2024-10-01
7839,334,266,79,1,Bad our exist onto.,2024-01-09
7840,545,193,2705,5,Operation hope though work international it evening choice.,2023-06-23
7841,662,437,718,1,Above beyond worker treat.,2023-09-09
7842,467,160,3747,2,Big agreement site.,2023-03-15
7843,947,289,8474,3,Reason charge probably east.,2024-12-30
7844,398,268,7169,2,Attack task across fine artist within fall.,2023-02-03
7845,636,144,8379,4,Always class notice follow somebody.,2024-11-01
7846,918,148,2722,4,Party continue structure special allow kind bit.,2024-03-26
7847,296,477,3104,1,Late after age mission.,2023-10-18
7848,295,233,1183,2,Bar line eye sit.,2024-11-21
7849,843,357,3216,1,Red item find hit north.,2024-02-01
7850,809,464,6877,2,Official anything project fill detail thousand skin.,2023-02-08
7851,109,96,1443,4,Oil candidate data road hospital.,2024-11-22
7852,809,162,7092,1,Hand put thank police put.,2024-03-15
7853,658,453,501,3,Need choose history manager coach.,2024-04-19
7854,322,144,4398,2,Positive such three century develop.,2024-08-19
7855,227,51,24,3,Take artist nature market factor area a.,2023-07-10
7856,943,304,6230,3,Director year smile actually rest wife activity.,2023-11-06
7857,880,478,2536,3,Pm establish consider want cup deep although.,2024-09-20
7858,279,167,3109,1,Week home here everyone offer.,2024-01-21
7859,727,72,7747,4,Me either sure decade will great.,2024-11-04
7860,703,314,300,1,Side recognize without treat century.,2023-07-02
7861,535,282,299,5,Forget fish value imagine might more stand morning.,2023-05-30
7862,797,173,6640,5,This mind hear place fast hand wind.,2024-06-19
7863,912,375,9693,3,Education several cut always nearly sense hundred.,2024-12-18
7864,720,7,5765,3,Animal herself carry property evidence price finish live.,2024-06-15
7865,546,336,3168,3,Past keep risk magazine word security employee.,2023-09-10
7866,587,415,7622,4,Late nearly community together sister.,2024-06-22
7867,590,469,4007,2,With imagine very poor.,2024-12-05
7868,831,205,7989,1,Level body spend head threat group.,2023-11-12
7869,131,53,8942,1,Wall like theory box large.,2024-02-01
7870,346,12,3157,1,Provide sure network charge arrive.,2023-12-06
7871,218,105,5231,1,Conference center together company.,2024-09-18
7872,687,57,9348,3,Line whole your child she glass.,2024-03-12
7873,788,48,7317,1,Assume something last garden board tell.,2024-09-30
7874,696,394,2468,3,Central pick imagine scientist break heavy step.,2024-08-23
7875,245,391,8544,3,Great need manager about future throw method.,2024-10-17
7876,730,311,1344,5,Beat collection seat Republican young.,2023-07-12
7877,377,90,2901,5,Somebody right citizen age draw believe child almost.,2024-01-28
7878,951,31,953,4,Employee give onto Mrs.,2024-11-02
7879,118,99,6388,5,Maybe player whether lay arrive draw go.,2023-09-08
7880,272,480,432,1,Bar today mission impact.,2023-10-20
7881,913,332,5330,1,Outside growth early study figure agency.,2023-03-07
7882,85,396,3191,3,Along per night American large become.,2024-09-13
7883,283,421,1080,3,Raise tonight project research friend.,2023-08-01
7884,441,458,306,2,Provide friend medical sea life firm.,2023-07-18
7885,830,359,8094,2,Choose ago early knowledge herself evening.,2024-09-16
7886,696,486,1807,1,Military have billion senior street gas out start.,2024-07-13
7887,990,191,2356,1,Program room environmental one most strategy attorney carry.,2023-11-14
7888,303,345,9241,1,Drug do reflect.,2023-11-19
7889,547,5,2052,3,Perform others early including piece.,2023-07-31
7890,741,409,8890,1,Born read TV explain form evidence stop.,2024-10-09
7891,168,199,3714,3,Reality name mouth start cover sound.,2024-01-16
7892,959,241,7525,2,Whose follow big hotel other.,2024-10-13
7893,76,313,1441,4,Message deal source light myself easy.,2024-06-01
7894,107,73,3688,1,Finish set create begin.,2023-02-24
7895,461,299,60,4,Case store because president one.,2023-06-08
7896,294,473,3263,5,Next report white feeling condition high.,2023-04-05
7897,138,413,6580,1,Option animal war respond beautiful.,2024-11-19
7898,645,292,8776,1,Beautiful evening recognize.,2024-12-29
7899,512,370,1331,4,Him forget book see decision.,2023-02-25
7900,310,443,2794,5,Husband style eat performance society.,2023-12-31
7901,138,231,8868,3,Great politics law leg.,2023-08-04
7902,784,291,7524,3,Draw toward range little past.,2023-01-13
7903,192,138,5973,5,Throughout value brother baby.,2024-06-16
7904,290,14,1095,3,Measure field cultural central.,2023-10-11
7905,467,138,5347,4,Reveal hot will same politics.,2023-10-27
7906,929,336,2241,2,History blood new.,2024-09-23
7907,788,479,8389,3,Bag peace shake plant later huge remain.,2024-10-08
7908,323,364,7303,2,Material concern I accept consumer agreement.,2024-03-24
7909,818,249,1817,5,Table small natural environmental student back.,2024-06-10
7910,980,47,3457,2,Line region usually many life yard chance.,2023-12-14
7911,929,172,638,2,Cut thus something end.,2024-03-21
7912,701,109,2326,2,None company change response analysis these remember.,2023-01-07
7913,572,231,3824,2,Sometimes also international follow board save.,2024-01-02
7914,813,119,8504,2,Tree more trip rest budget certain.,2023-05-26
7915,331,203,4825,4,Shake level skin take indeed.,2023-07-20
7916,945,377,6420,5,Heavy other news eat.,2024-12-01
7917,191,342,8935,3,His either somebody against this.,2023-01-04
7918,806,393,9046,2,Success view enjoy evening pass trade.,2023-08-09
7919,780,205,8363,4,Listen today interview maintain country decade.,2024-04-19
7920,840,410,6671,5,Recent involve blood.,2024-08-29
7921,804,310,7662,4,First various name statement reveal crime save detail.,2024-01-15
7922,255,19,8057,3,We available apply many.,2023-10-03
7923,209,52,5689,4,Catch wonder defense.,2023-10-29
7924,9,164,6535,3,Result data grow discussion ground.,2024-12-26
7925,189,200,765,2,Serve past cause similar environmental also.,2024-07-15
7926,391,305,8902,1,Special physical buy actually.,2024-12-19
7927,454,179,6758,4,Forward war test.,2023-01-17
7928,822,327,8823,5,Friend spring thus professional contain.,2024-07-16
7929,992,122,3440,2,Family career society air television society.,2023-10-13
7930,729,97,2006,3,Foreign movement week operation.,2023-11-03
7931,984,1,7759,4,Chance program school knowledge finally until.,2024-06-04
7932,429,266,5089,3,Nothing trouble structure yet under.,2024-10-17
7933,903,471,2293,1,Through build science catch surface on offer.,2023-11-10
7934,688,128,1967,2,According worry wear recently.,2024-03-30
7935,139,64,3292,5,Middle help with oil growth.,2024-05-28
7936,96,466,4153,3,Laugh Congress only evening.,2024-04-28
7937,802,72,6994,5,Especially list there among catch notice seek.,2023-08-21
7938,739,493,3956,4,Blue couple identify year sister cultural.,2023-07-05
7939,881,495,1195,1,Sure person have test manager arrive likely.,2023-04-10
7940,327,303,4908,4,Phone girl spend trial owner order.,2024-01-13
7941,867,335,4302,4,West test full.,2024-08-28
7942,771,111,9570,5,Show TV capital describe.,2024-12-09
7943,419,238,9888,4,Allow look though capital industry.,2024-11-30
7944,645,89,7105,4,Direction wait take challenge.,2023-10-11
7945,548,407,6168,4,Only agreement chair better.,2023-12-17
7946,682,208,3725,2,Walk standard deep suggest leader significant.,2023-09-17
7947,459,22,9264,1,Despite consumer must success contain board.,2024-07-29
7948,674,430,2272,1,Game news want fire run culture guy whose.,2024-07-28
7949,147,457,9058,5,Of right she benefit enjoy whose however also.,2023-12-17
7950,649,368,9329,5,Bag between weight dream well response mouth cultural.,2023-11-18
7951,881,472,5239,1,Save of appear quality family political lose.,2024-07-31
7952,100,467,3986,3,Open another director save manager.,2024-06-14
7953,321,161,9424,5,Past building hear long act unit produce.,2023-02-18
7954,271,375,4469,5,Water pull where rise able student poor skill.,2024-07-18
7955,939,469,4184,5,Anyone east wish note American.,2024-05-01
7956,467,170,9388,4,Energy build brother party.,2023-07-07
7957,519,118,7242,2,Sister least apply hand threat if project pretty.,2024-12-07
7958,163,145,8160,1,See night own camera.,2023-02-10
7959,103,72,5893,4,Sometimes attorney look person indicate recognize buy.,2024-04-17
7960,880,390,7518,5,Produce day southern.,2024-12-29
7961,866,478,3604,3,People last language us over difficult marriage.,2023-12-11
7962,608,335,5974,3,Unit inside wonder staff local organization letter.,2024-08-31
7963,591,153,1036,1,Compare bill until student account.,2024-11-27
7964,662,386,5378,5,Reflect stuff police quality return move others clearly.,2023-05-16
7965,502,370,3460,1,Technology community still religious if result.,2024-12-31
7966,652,312,3866,2,Sense unit design air institution dog just notice.,2023-04-26
7967,572,52,7563,3,Commercial meeting position century street discover.,2024-07-01
7968,216,55,2011,2,Hundred side north relationship.,2023-02-27
7969,478,117,7604,3,Method bad artist radio main area public.,2023-12-24
7970,238,453,2781,2,Instead test stage development.,2023-01-21
7971,400,42,5363,1,Feeling product born door enough.,2023-06-29
7972,933,215,2024,3,Across set bag.,2024-10-10
7973,419,146,1472,2,My final Congress choice force land.,2024-10-15
7974,161,378,4702,3,Commercial budget ball avoid region deal agent.,2024-09-06
7975,867,157,1116,2,Item understand partner thus remember tough deep.,2024-04-24
7976,851,213,8341,2,Itself trade herself staff cut.,2024-06-25
7977,800,491,5321,1,Federal spend candidate.,2023-05-14
7978,373,182,289,5,Discussion cause within choice law we story.,2023-08-14
7979,8,70,4848,2,Figure campaign military reality would body help list.,2023-06-23
7980,37,462,2348,4,Film age change situation.,2023-03-14
7981,170,241,505,1,Statement themselves team feeling.,2024-04-19
7982,122,488,2251,1,Car perform continue body.,2023-03-28
7983,392,347,3201,3,Letter perhaps though north turn discuss.,2024-11-18
7984,807,413,5847,2,What sign material wife current worker now.,2024-10-22
7985,761,20,9379,1,Individual foreign lay few edge.,2023-10-13
7986,919,186,5875,2,Way I hospital front nation.,2024-10-07
7987,698,464,6045,3,Suggest race area join fly.,2024-09-10
7988,834,257,3365,4,Manager hair hour official popular truth.,2024-11-26
7989,626,410,4179,3,Even fine response include address miss.,2023-06-18
7990,925,361,9749,5,Production worker wish could whatever life agree religious.,2023-01-03
7991,553,357,2982,4,Meeting check early south price.,2024-12-14
7992,892,170,6698,5,Little high agreement when happy.,2023-10-30
7993,563,86,4548,3,Well man among charge wind could either.,2023-09-09
7994,169,317,1992,3,Character price seek sport there there level.,2023-12-13
7995,310,367,5792,2,Without situation others style.,2023-09-26
7996,954,137,6917,5,Rule book indeed movie wonder forward move.,2024-08-13
7997,937,128,6535,5,South specific land through.,2023-04-29
7998,669,86,4878,2,Line prove national explain culture see.,2024-08-19
7999,103,348,5166,1,Town car voice power produce audience.,2023-06-19
8000,848,227,1764,1,Already could send federal upon usually.,2024-08-26
8001,986,483,2767,4,Analysis direction goal benefit woman.,2023-03-23
8002,459,112,4937,1,Show recent build that.,2023-12-14
8003,528,17,8884,3,Half local effect fill ability over.,2023-04-16
8004,410,256,3777,3,Space lose hair police.,2024-04-08
8005,165,381,8078,2,Soon prepare begin space pattern west heavy.,2024-08-23
8006,519,379,9983,1,Travel report simply data.,2024-05-27
8007,666,87,6250,1,Food hear check Democrat.,2023-07-26
8008,940,360,8918,2,Economic not again save true.,2023-01-08
8009,26,282,9717,4,Girl my ago determine.,2024-04-26
8010,936,145,8010,5,Prove do foot national anyone better yourself film.,2024-03-02
8011,704,401,1148,4,Dream energy character animal change because foot pass.,2023-10-17
8012,842,349,2212,3,Own deal director politics measure prevent.,2023-02-25
8013,514,247,7316,1,Stage run cultural them usually chair sport fine.,2023-07-14
8014,926,207,9977,3,Could wear another meeting right.,2023-07-17
8015,256,4,3717,1,Research wind local reflect.,2024-09-18
8016,772,500,3379,3,Size third detail him early imagine.,2023-05-19
8017,987,106,6124,2,Tax house study time.,2023-10-08
8018,376,122,4443,5,To billion eat into research.,2023-11-23
8019,755,416,6528,3,Check service eye amount focus security.,2024-02-19
8020,830,450,7459,5,Strong compare spend girl single.,2024-12-07
8021,606,387,5132,5,Produce man foreign defense population maintain.,2023-10-01
8022,145,414,3263,5,Door account section despite late better low.,2024-08-02
8023,68,226,1858,4,Win go lose seem throughout.,2024-12-28
8024,881,100,5613,3,Wind put girl away animal and shake.,2024-10-12
8025,618,241,8516,5,There force get black discover.,2024-11-27
8026,688,478,4257,5,Structure none fine yard certain.,2023-12-02
8027,860,163,2392,4,Thus their free travel minute.,2023-12-06
8028,89,299,4113,2,Place approach truth in throw.,2023-11-04
8029,511,318,56,5,Out surface song appear opportunity light manage.,2024-05-23
8030,990,435,4728,2,Civil reality local threat finally rule.,2024-11-08
8031,33,165,7952,3,Security water meeting wife letter research eat.,2023-12-19
8032,656,38,8263,4,Friend office stuff interest as pattern.,2024-03-19
8033,329,11,9723,3,Baby operation third suffer side way goal tough.,2023-04-07
8034,393,16,5413,5,Decade majority lead upon budget always.,2024-04-17
8035,649,288,830,5,Station matter happy mother around fall.,2023-08-01
8036,924,130,1687,5,College country suggest peace though.,2024-02-03
8037,893,316,697,1,Bring set data through miss.,2023-02-13
8038,999,189,3445,2,Among seek consider usually read letter.,2024-01-27
8039,823,71,6681,4,Participant central agree sometimes put explain surface.,2023-12-26
8040,738,465,970,2,Who to have seem.,2024-05-21
8041,816,432,2724,1,Feel fight believe since want professor drop.,2023-04-21
8042,259,409,1129,4,Possible expert among beautiful yeah defense clearly.,2023-04-11
8043,208,207,1034,5,Worry professor general feel smile.,2024-04-02
8044,537,500,135,5,Develop step news company.,2023-07-05
8045,917,423,4417,2,And rather physical world nor change.,2024-03-13
8046,99,46,2945,4,One over marriage while.,2023-11-29
8047,807,275,4346,1,Country side lawyer case within not entire.,2023-01-01
8048,855,290,3103,1,Stay write toward.,2024-02-22
8049,141,84,5466,4,Share deal condition sell arm address such.,2023-11-04
8050,423,360,4617,2,Adult politics save hair little.,2024-05-25
8051,890,487,215,3,Music usually six person.,2023-09-09
8052,22,330,6363,1,Guess operation culture.,2024-05-11
8053,137,333,9425,5,Upon course defense cell response agreement road.,2023-10-21
8054,878,235,4930,2,Will artist group different thank hard care approach.,2024-09-16
8055,268,472,6433,4,Over recent government tend far because me.,2024-12-11
8056,127,143,6241,5,Pm threat leader cover gas know.,2023-10-29
8057,403,447,2912,1,Member wind contain world require buy.,2024-08-29
8058,149,343,5248,4,Science single fill study response site.,2023-11-14
8059,510,471,92,5,Know marriage light someone seek go he.,2024-01-20
8060,166,445,914,5,Employee very situation price fall.,2024-09-03
8061,264,393,2382,2,We spring south son course current difficult indicate.,2024-03-30
8062,136,62,8897,5,Everybody lay offer ok improve.,2024-02-28
8063,954,483,1602,3,Six lot continue song despite relationship.,2024-11-28
8064,316,284,2683,4,Carry key its mind reality might thought.,2023-02-28
8065,212,59,7958,2,Body public develop study hot wrong quite.,2023-09-11
8066,224,127,9012,3,Government region campaign Mr political anything.,2023-10-08
8067,624,414,3513,5,Receive conference possible everyone.,2024-01-31
8068,871,312,6281,1,Tree enter discuss point.,2024-02-11
8069,437,135,9711,3,Wide nation would site if.,2023-01-19
8070,608,433,2917,4,Pass minute worker film wait attack similar.,2023-08-24
8071,260,89,3619,3,Should involve personal.,2024-02-07
