rating_id,customer_id,restaurant_id,order_id,rating,review,rating_date
2317,422,459,2686,3,Item per wrong fight get hold right.,2024-07-10
2318,904,103,9468,2,Scientist oil cup add term history.,2024-01-31
2319,742,10,1683,1,Benefit leave speech industry understand hour site.,2024-11-29
2320,210,212,5102,2,Add a weight role.,2024-12-12
2321,168,194,9410,5,Government police never radio.,2024-10-10
2322,560,87,7746,4,You chance statement industry.,2023-06-30
2323,206,96,415,4,Never affect various anyone.,2023-09-29
2324,817,239,495,4,Police yourself position include sense son mind almost.,2023-01-01
2325,482,48,8757,2,Never owner resource everything door huge.,2024-10-02
2326,553,89,7590,4,Approach fly decision.,2023-11-28
2327,128,246,4576,5,Before see that management speech exactly.,2024-05-25
2328,411,126,4864,2,Soon rule doctor grow enough matter.,2023-12-11
2329,101,222,7869,3,Outside never general popular believe.,2023-04-05
2330,961,267,3564,1,Grow suffer ever black within paper development.,2024-07-03
2331,575,132,278,3,Enjoy wide himself travel score offer.,2024-11-08
2332,818,391,5948,2,Nor woman trade room will.,2023-06-19
2333,8,487,9881,3,Between country do spring energy them.,2024-07-09
2334,296,460,3557,2,Mind wonder study possible no change.,2023-01-08
2335,882,276,7905,2,High series with experience start style.,2023-06-01
2336,625,204,8080,5,Home rest line partner.,2024-02-01
2337,35,293,2075,1,Exactly play public medical open.,2024-02-17
2338,661,312,4738,4,International every day physical as.,2024-11-24
2339,916,216,572,3,Challenge professor then tend cause.,2024-10-29
2340,682,348,6468,4,Minute over air church.,2024-12-15
2341,403,227,2936,4,Throughout bit develop product.,2023-12-14
2342,270,468,5673,5,People wind international there role.,2024-07-05
2343,607,48,2673,2,Most base power court.,2023-06-05
2344,465,471,6232,1,Any then teach series season history finally.,2023-09-25
2345,343,252,5086,2,Believe open election rest father.,2024-02-24
2346,530,279,2156,1,Attorney soldier board kind prevent.,2023-09-26
2347,399,63,7581,3,Visit finish cold establish single father address.,2023-12-20
2348,570,177,8569,3,Low specific where institution.,2023-05-27
2349,218,433,3974,5,Political very eight can conference.,2023-05-06
2350,903,165,6745,5,Add fear one result thank difficult.,2024-04-20
2351,612,420,4586,4,Government no know country computer.,2024-10-31
2352,30,135,7377,2,Others join including probably degree along.,2023-04-09
2353,988,410,4273,2,Arrive gun indeed option four shake deal.,2023-11-03
2354,270,1,6625,1,Chair do this century job feeling deal.,2023-09-04
2355,451,174,2688,3,Property trouble computer fall.,2023-11-26
2356,167,126,8357,5,Reveal southern clear near oil.,2024-08-29
2357,122,303,5475,2,These final difficult.,2023-09-09
2358,131,375,5944,5,Out within imagine year fly small.,2023-06-15
2359,252,174,2452,5,Science two garden themselves impact bill bit.,2024-04-19
2360,610,147,9102,1,Save college purpose often wonder.,2023-05-25
2361,556,29,732,1,Reflect poor exist staff.,2024-08-04
2362,148,457,872,4,Investment its without young.,2024-02-07
2363,904,353,1299,2,Film administration number style around probably man through.,2024-10-26
2364,561,160,9433,5,Throughout future eye this gas number.,2023-02-28
2365,233,383,3979,2,Unit sing level part.,2023-04-18
2366,985,355,3324,2,Protect government front rather trade.,2023-12-03
2367,874,232,4678,5,Argue professor thus institution remain town sense instead.,2023-02-13
2368,559,369,7280,5,Support father draw or adult some fish or.,2023-03-12
2369,66,445,6672,5,Ready far red throw soon food let.,2023-06-21
2370,351,182,90,1,During school like certainly increase.,2023-02-14
2371,419,193,6481,5,Still our ok here quite.,2023-03-08
2372,493,241,5805,1,Hundred standard and drop window officer main.,2023-05-28
2373,195,297,6314,4,Church beyond light list his identify ahead citizen.,2023-02-23
2374,127,216,8218,3,Concern project model former.,2024-02-12
2375,479,67,7413,4,Bit remember ago skill.,2024-09-17
2376,640,26,3730,4,Catch while worker wide start benefit his.,2024-07-25
2377,236,262,2561,4,Tonight skin decide money we point.,2023-10-17
2378,258,47,8475,5,Effect know child serve power hour.,2024-03-25
2379,53,392,8355,5,Receive deal may possible.,2023-11-15
2380,99,390,814,3,Station nature send everything training course choice sport.,2024-07-17
2381,204,114,8521,1,Yet establish record teacher everything parent.,2024-05-01
2382,376,339,1291,5,Experience first our fear.,2024-04-29
2383,772,403,1255,4,Name administration sing bed.,2024-01-19
2384,994,123,7197,3,Position mention accept religious floor increase outside.,2024-08-07
2385,247,475,416,1,Perform add page than loss among guy.,2024-06-22
2386,946,262,121,4,Easy consumer owner current time.,2023-09-01
2387,920,431,7964,3,Race painting us today actually information charge.,2023-03-30
2388,684,487,8529,3,Key exist modern common quickly language.,2023-09-08
2389,639,18,4921,4,Decade black there unit interesting first though skin.,2024-02-09
2390,840,404,8324,1,Onto local it.,2024-04-16
2391,301,328,5706,2,Reveal tough camera.,2024-12-20
2392,567,432,8801,2,Reason smile age respond take wind difficult.,2024-04-04
2393,690,198,7803,5,Smile several travel federal.,2023-02-07
2394,206,123,4609,2,Attorney include half within by.,2024-06-10
2395,266,169,2711,4,Attorney perform responsibility list.,2024-12-19
2396,179,68,7609,4,Remember power exist small list water.,2024-09-04
2397,797,485,9235,3,Throw reflect thing street else color southern.,2024-11-21
2398,246,8,929,1,Pick without former list may they study.,2024-06-23
2399,932,234,6541,3,People either within play fear support sell.,2024-11-02
2400,129,59,6994,2,Have scientist amount nothing pull recently easy.,2023-11-06
2401,83,439,8767,4,Behavior half federal others.,2023-08-08
2402,559,240,9039,4,Surface international perform they might television per.,2024-07-23
2403,922,426,678,1,Protect resource fire bill explain.,2023-11-08
2404,896,142,4679,4,Society hair foreign high wonder.,2023-08-01
2405,351,424,9650,1,War skill responsibility nearly character.,2023-07-09
2406,801,304,8765,2,Field happen still large learn.,2023-10-06
2407,137,460,9489,4,Nature realize still page big report tend deal.,2024-12-22
2408,501,41,8415,5,Team trial close economy successful.,2024-05-30
2409,644,322,2903,2,Doctor body catch increase.,2024-12-10
2410,606,347,1260,3,Around east third into order rich fight.,2024-08-13
2411,390,452,2957,4,Any attorney may speech.,2023-04-04
2412,989,313,6023,2,Nation cause southern few feeling myself.,2024-08-29
2413,841,408,3122,4,Wide growth animal democratic seven.,2023-07-27
2414,66,208,1392,4,Chair face stock together up she.,2024-12-09
2415,476,69,2202,5,Television prevent before seat structure politics Congress local.,2023-05-08
2416,477,186,3662,5,Still class full factor.,2024-02-14
2417,596,257,9789,2,Certainly agency laugh room.,2024-11-10
2418,286,171,7735,1,Face magazine order condition with.,2023-04-03
2419,394,420,7962,3,Event manager responsibility happen tree never certain subject.,2024-03-26
2420,871,81,7291,3,Modern defense either win we lot.,2023-05-16
2421,970,152,9186,5,Can by for out cost.,2023-09-20
2422,850,274,8933,3,Put eight then accept.,2024-08-06
2423,630,223,1436,3,Take military back.,2024-06-03
2424,691,377,5487,2,Mother mind pick science parent kind her rule.,2023-01-23
2425,540,360,4164,2,Operation eat main.,2023-08-18
2426,49,235,8360,4,Fly community bill stuff later.,2023-01-31
2427,709,57,8460,4,Action minute theory director car at.,2024-02-21
2428,302,460,3931,2,Oil certainly rate activity sometimes movie hand call.,2023-08-02
2429,827,382,9270,4,Treatment that partner bad always big.,2023-11-10
2430,928,100,5772,3,Science discover age young rock total.,2024-04-03
2431,312,88,3069,2,Old life report consider.,2024-04-22
2432,267,458,3013,3,Rich product whose.,2024-05-31
2433,628,172,2281,2,According than difference main half walk concern mind.,2024-01-26
2434,36,16,2533,4,Modern factor learn vote painting prevent prove add.,2023-04-17
2435,681,376,3451,1,Close lot hour.,2024-03-30
2436,426,282,4110,5,Teacher as base even local thus phone better.,2023-07-25
2437,335,125,8450,2,Inside receive within people Congress young.,2023-03-02
2438,586,62,9627,2,Great stand four PM loss account.,2024-12-29
2439,759,101,9675,5,Research candidate page hear cause.,2023-01-10
2440,383,283,7480,1,Scene simply network fish sure experience.,2023-06-05
2441,296,161,4318,5,If remain coach late season second theory.,2024-03-25
2442,821,334,7610,4,Student several one nothing beautiful student talk.,2023-10-30
2443,376,390,2175,4,First produce trip result reflect name.,2024-07-14
2444,865,484,603,1,Little present alone.,2024-05-18
2445,943,60,6430,5,Choose baby scientist event seem edge remain.,2024-08-25
2446,397,116,6581,2,Through role decide dog company feel.,2023-01-11
2447,145,409,2462,3,Save time reveal that.,2023-03-12
2448,952,50,3751,2,Right church until various customer Congress others.,2024-08-08
2449,34,28,6960,5,Environmental from age Congress impact system deep.,2024-03-15
2450,751,244,3773,3,Develop so weight.,2024-05-03
2451,919,23,923,2,Dinner situation many.,2023-01-12
2452,363,12,9289,3,Three arrive rest.,2024-05-08
2453,832,302,349,4,Dark allow create nation tree miss.,2023-07-13
2454,729,491,7564,5,Attention push toward good agreement.,2024-08-28
2455,593,66,869,3,Cover cup economic happy majority.,2023-05-20
2456,771,309,8641,3,Game growth pick go head doctor loss local.,2024-06-28
2457,913,98,9912,1,Possible man country perform.,2023-11-02
2458,3,254,6118,1,Want commercial subject computer.,2024-06-10
2459,664,426,1280,1,Discussion while for.,2023-03-12
2460,339,332,4552,3,Staff order bag some financial simply pressure.,2024-04-11
2461,469,270,1864,2,Agree friend major team.,2023-02-02
2462,751,126,4,1,Move lose listen.,2024-06-12
2463,929,375,3296,4,Budget arm food produce certainly enter.,2024-06-28
2464,532,74,7509,2,Seek remember both affect nearly another approach.,2023-06-25
2465,454,93,4030,2,Under film able actually might thought student.,2024-03-16
2466,67,71,3495,1,Politics material Democrat property.,2023-07-10
2467,559,97,1583,4,Degree so own watch condition offer rise.,2023-09-04
2468,324,296,7672,5,Why performance despite say page.,2024-05-05
2469,511,297,3196,3,Provide soldier something.,2023-11-04
2470,64,127,3197,1,Trial most party sign listen peace.,2023-05-29
2471,159,274,540,5,Agent girl will TV president election.,2023-12-31
2472,838,4,9527,3,Voice letter power wall talk Mr.,2024-04-06
2473,795,169,1048,2,Knowledge color hear include plant effect.,2023-08-25
2474,422,129,1827,1,Someone those great century water beautiful.,2024-11-11
2475,923,415,3855,2,Mind several whose most down race.,2023-05-18
2476,965,218,9830,1,Rise parent speak commercial.,2023-03-12
2477,864,10,1444,2,Build however when themselves.,2023-04-19
2478,872,169,9271,2,Feeling bill station thought clear her peace voice.,2023-03-02
2479,222,206,9862,4,Skin history power foreign.,2024-11-11
2480,145,136,8837,5,Medical gas security interest season account.,2024-11-19
2481,623,445,5278,4,Floor health hard consider network perhaps.,2023-07-02
2482,160,187,8760,2,Building never lawyer reach price late ask.,2024-03-30
2483,226,498,9026,2,Break ago large thousand central attorney east book.,2024-06-26
2484,533,65,7093,2,Eight drop billion you use space.,2023-10-20
2485,245,376,1809,3,Task standard heavy investment.,2024-11-08
2486,846,42,1877,1,Single offer support top.,2024-07-09
2487,83,289,5946,2,Treat PM glass happen.,2024-01-25
2488,624,269,4023,5,Challenge car white same if see energy old.,2023-07-02
2489,613,269,9921,1,Nation weight focus possible skill.,2024-09-15
2490,661,169,5830,2,Teach result treat police traditional above several.,2023-12-16
2491,461,10,6671,5,Yes floor eat safe live parent bad animal.,2023-04-05
2492,794,133,118,1,Present environmental require writer.,2023-05-15
2493,980,128,6346,4,Project company against change.,2023-06-20
2494,506,189,6975,3,Say can report central western.,2024-08-20
2495,594,335,5238,2,Minute figure natural close serve magazine pay.,2024-05-10
2496,448,345,3228,4,Seem better eight chance international own officer process.,2024-09-08
2497,789,64,4066,5,Eye medical all positive they room.,2023-01-19
2498,870,46,5896,1,Sort federal bag.,2024-07-09
2499,987,300,9606,5,Young toward there trouble class space trade.,2024-05-31
2500,296,395,5481,5,Name involve oil listen she what writer.,2023-03-08
2501,13,102,5138,5,Yourself increase house place pull dinner.,2023-09-26
2502,202,197,201,1,Paper full section general country study the.,2023-06-08
2503,460,368,6604,1,House leave standard campaign.,2023-03-04
2504,284,317,5685,5,Though run special drop science middle.,2024-10-09
2505,751,51,9285,4,Bit health service cell class popular option.,2024-02-12
2506,247,208,2671,3,On fact really man wall.,2024-09-14
2507,835,29,3009,2,Quality near in save source part the everyone.,2024-08-11
2508,728,318,9218,4,Yet she couple leader read smile.,2024-02-05
2509,893,101,4153,2,Live none public able dinner.,2024-05-30
2510,121,11,6639,3,Treat financial manage both large.,2024-05-02
2511,766,268,7125,3,Step stock ever close.,2023-05-28
2512,33,479,2084,2,Old fine in social movie author.,2024-12-13
2513,140,95,6740,1,World exist rise picture Congress animal yourself carry.,2024-08-24
2514,370,75,3032,5,Real society human send discover so day.,2024-12-22
2515,19,1,4485,1,Development big animal in.,2023-04-05
2516,234,261,918,1,Behind within enter general.,2023-02-02
2517,136,23,8742,4,Send lead region.,2023-02-04
2518,714,375,3116,3,Head evidence first per.,2024-05-22
2519,966,465,8082,2,Final attention enter certain thus professor.,2023-11-03
2520,801,80,5005,2,Strategy floor remember deep present case gun.,2024-01-27
2521,847,477,2668,4,Tough prove situation occur baby care risk.,2023-07-31
2522,340,90,695,1,Popular good air father throw source at.,2023-06-10
2523,942,423,3145,3,Particularly place question focus.,2024-04-13
2524,183,312,9951,4,Child design all position finally these from.,2024-04-11
2525,759,306,609,5,Step single memory.,2023-12-04
2526,797,267,1238,5,Music seat you quickly.,2024-01-02
2527,599,351,4431,4,Trade paper majority just item even glass.,2024-09-13
2528,644,272,7763,1,High machine those everybody matter walk.,2024-01-11
2529,599,142,5168,4,Discover surface human never former.,2024-09-09
2530,871,26,1984,4,Without offer close pressure.,2024-10-20
2531,183,190,3775,2,Very structure city summer fly ball order.,2024-09-24
2532,51,77,7389,3,Special tree enjoy direction under.,2024-06-01
2533,315,111,5681,2,Amount interesting per reach experience energy health analysis.,2024-04-11
2534,184,396,8597,2,Soon let wrong money.,2024-01-30
2535,532,185,5498,4,Air fund land.,2024-01-31
2536,820,271,4720,5,Full material difference vote sure.,2024-11-29
2537,52,160,4779,2,Security live onto stay discuss.,2023-03-03
2538,729,232,3055,2,Center too draw imagine.,2024-04-14
2539,565,45,2343,5,Radio establish run decision dog east receive.,2024-10-17
2540,467,270,5893,3,Exactly real officer doctor special central score.,2023-11-20
2541,266,84,2537,1,Cause may drop different talk read form.,2023-03-25
2542,731,355,7417,4,Maintain land beyond increase.,2023-09-10
2543,791,244,9737,3,Kitchen common effort two those seat.,2023-02-22
2544,203,230,6042,4,Drive tree deep clearly authority region.,2024-04-17
2545,602,460,7581,2,Over father investment but affect.,2024-04-12
2546,304,365,9194,1,Side describe challenge side.,2023-10-23
2547,613,96,2872,3,Edge mean back argue arrive through oil.,2024-03-24
2548,450,221,3585,3,Big at sense mind argue American.,2024-01-13
2549,170,237,1573,3,Here expect stuff yet age hundred develop guy.,2024-09-29
2550,6,237,6852,5,Card spring allow give.,2023-04-18
2551,628,85,1012,5,Analysis beat after power street.,2023-06-30
2552,144,478,6858,2,Ok group drop coach.,2024-05-11
2553,646,347,6037,3,Agreement beautiful specific medical.,2023-07-25
2554,409,440,8063,3,Book dark top outside.,2024-03-20
2555,915,87,2688,2,Various production policy already soon.,2023-08-27
2556,685,225,165,3,Camera off group question allow.,2024-05-07
2557,676,172,8338,5,Issue name phone hospital.,2023-04-04
2558,493,499,4078,2,Night her produce too above meeting hour.,2023-01-10
2559,800,125,9134,4,Yourself skin main idea million answer song.,2024-02-17
2560,507,370,7259,1,General assume assume tend writer education recognize lead.,2024-08-15
2561,641,263,7829,4,Around instead food our individual.,2023-09-06
2562,52,148,2837,1,Cause possible usually item national store never nature.,2024-11-25
2563,311,84,8493,1,Development skin around picture season.,2024-09-15
2564,264,489,3749,1,Page husband become prepare.,2023-01-24
2565,647,97,3109,1,Yet per many open girl.,2024-07-02
2566,632,367,3842,1,Animal course who.,2024-10-08
2567,245,152,5017,5,They bad manage near own.,2023-05-16
2568,138,93,2529,5,Anything campaign their red force he wide.,2023-06-07
2569,837,118,4816,3,Listen threat music assume better.,2024-09-27
2570,54,151,5352,2,Bag allow goal voice find enter imagine.,2023-11-18
2571,165,28,5887,1,And sing dream investment responsibility think him.,2023-09-12
2572,398,404,7374,5,Strong sister wear attack the a.,2024-12-05
2573,521,26,7304,5,Seven reach avoid program although.,2023-07-16
2574,194,258,4223,5,Be change age.,2024-10-19
2575,562,417,6577,5,Wife tree other film court move.,2024-01-31
2576,842,87,58,2,Rather mother beyond provide whose shoulder visit.,2024-03-06
2577,96,344,6464,5,Woman indeed sister catch direction thought per.,2024-06-06
2578,314,125,6900,1,City through day enjoy employee allow structure.,2023-03-27
2579,277,365,6954,1,North condition miss letter prepare.,2023-04-25
2580,244,403,1638,5,Church use knowledge collection child.,2024-05-01
2581,737,250,6037,4,Television care yet travel serious a.,2023-08-24
2582,36,314,1253,2,Adult describe necessary day piece us husband.,2024-03-19
2583,993,111,5450,5,East yes brother station.,2024-10-15
2584,715,466,7399,3,Standard song level test.,2023-10-08
2585,30,22,403,5,Finally myself always amount tonight property course.,2024-10-18
2586,238,212,61,4,Town interesting skill air government.,2024-11-02
2587,652,183,8255,5,List feel technology TV.,2023-08-28
2588,432,223,9246,3,Century station meeting glass.,2024-08-23
2589,334,39,6732,4,Actually join appear Mr build cut.,2023-07-20
2590,556,332,9870,3,Those white establish election people each.,2023-01-13
2591,931,214,2026,4,Fly shoulder right.,2024-12-16
2592,130,307,8074,5,Field capital even century sing maintain report nature.,2024-11-24
2593,513,161,3566,4,Son enter audience.,2023-02-10
2594,607,388,6657,2,College nor since thank significant summer.,2024-06-22
2595,192,42,4471,3,Face owner well consumer school also.,2023-07-06
2596,297,5,9165,1,Agent book tree itself cup.,2023-12-22
2597,860,305,9480,5,None education something fear against top response perform.,2024-07-23
2598,23,170,9475,4,Someone somebody type performance run yes opportunity hold.,2023-11-02
2599,654,440,8176,2,Low finish thousand church director career sometimes PM.,2023-10-06
2600,440,120,1871,2,Reason shoulder arrive current.,2023-05-27
2601,976,499,4980,5,Mind account your we past toward everything.,2023-01-21
2602,492,420,9755,1,Person voice cause behavior chance hot.,2024-09-19
2603,730,497,4391,3,Similar soldier ago.,2024-05-01
2604,43,282,6721,2,Into simple suddenly piece attention.,2024-09-16
2605,227,260,1906,3,Suddenly former catch far follow mouth.,2024-01-11
2606,629,231,2875,4,Growth wonder north protect particular very space.,2024-06-13
2607,906,439,413,5,There model option.,2024-12-26
2608,63,70,9706,3,Century structure with.,2023-03-30
2609,298,229,7381,4,On include agent.,2024-11-28
2610,534,477,8615,4,Bed above heart capital.,2024-07-07
2611,209,440,1254,4,Change old part small else.,2024-03-04
2612,143,354,8567,5,Present among cover should friend leave.,2024-04-09
2613,92,82,389,3,Such window much particularly human against.,2023-09-09
2614,753,237,65,4,My lose quite present day impact into.,2024-08-25
2615,674,225,4537,5,Large participant partner analysis building.,2023-03-14
2616,709,118,3889,3,International street star need surface.,2024-05-10
2617,340,303,5061,2,Full amount age director some little detail good.,2024-02-20
2618,73,345,5828,3,Away general report result.,2023-09-11
2619,624,301,228,1,Visit buy board its pick fill.,2023-10-28
2620,930,166,8133,1,Short book issue international.,2023-07-26
2621,852,427,1455,3,Career standard operation both clearly price direction worry.,2023-01-15
2622,339,458,1472,2,Vote part much second stuff.,2024-04-02
2623,222,150,8355,2,Say within to less.,2023-11-26
2624,610,270,8986,2,Late before argue.,2023-01-10
2625,392,328,1344,3,Night street great you face.,2024-06-26
2626,522,28,8033,2,Or send help.,2023-03-08
2627,72,226,1935,2,Democratic by son game commercial.,2023-04-25
2628,1,275,4773,2,Economic policy around or six.,2024-08-24
2629,85,348,4706,4,Clearly sit this sure bring trouble law.,2023-04-07
2630,922,319,6915,4,Kitchen official I challenge organization door sign.,2023-11-25
2631,417,241,2424,3,Main situation might beautiful born itself.,2024-12-08
2632,629,173,4079,2,Even tonight despite sister I rock police.,2023-10-28
2633,71,42,8699,1,Professor doctor forward cost dark its.,2023-11-08
2634,726,425,7972,2,Different nearly place as effort would manage.,2023-12-07
2635,600,351,5667,5,Return claim hear actually building establish.,2024-12-16
2636,957,197,7085,4,Sister visit whatever prepare strong room.,2024-10-02
2637,388,41,5114,3,Century whether manager sound source year matter.,2024-03-27
2638,960,401,7071,1,Attention yeah attack decide.,2024-08-10
2639,225,440,1738,2,Central board whose.,2023-01-02
2640,144,405,9429,5,Debate item either cut such.,2023-07-11
2641,863,40,4419,5,Information think international could.,2023-11-20
2642,28,117,7380,3,Anyone social clear employee public.,2023-05-20
2643,817,166,543,4,Two type choice stay natural everybody necessary.,2024-12-31
2644,613,469,7816,2,College store red task prepare reason.,2023-02-02
2645,678,27,9460,3,Home history theory.,2023-01-14
2646,56,249,3260,1,Determine perhaps since kid adult.,2023-02-17
2647,965,462,7870,5,Computer statement yes American example both soldier.,2024-03-02
2648,9,180,5005,4,No kitchen guess day player green two.,2024-11-01
2649,478,309,8381,3,Expect cause know try speak morning.,2023-08-19
2650,193,14,5081,2,Other shake focus strong.,2024-02-24
2651,69,214,9057,4,Could table shake toward.,2024-07-12
2652,197,208,370,5,Still thought edge.,2023-07-26
2653,648,199,9581,5,Necessary analysis Congress long.,2023-10-02
2654,403,431,5490,2,Hit time particular senior accept treatment positive.,2024-12-30
2655,818,230,2000,1,Buy white sister.,2024-01-28
2656,392,69,7193,3,Get tough even our life.,2023-07-23
2657,443,459,9346,5,Four situation hair nothing.,2023-06-12
2658,956,95,7246,1,Thing letter sure sit artist wall store.,2024-11-01
2659,694,189,7293,3,Reflect tough evening.,2024-12-26
2660,708,316,6948,2,East walk gas manager quite decision.,2024-09-29
2661,359,90,9677,3,International determine concern ground expect five maybe.,2023-07-31
2662,174,439,2833,1,Professor artist himself rock despite.,2023-04-11
2663,233,401,5654,5,Across region will majority.,2024-04-06
2664,935,490,9355,4,Raise because more team while.,2024-12-31
2665,6,244,2661,2,That debate myself everyone choose.,2023-08-23
2666,408,422,1340,4,Better film there trade possible.,2024-03-09
2667,266,147,6694,2,Budget across clear.,2023-10-03
2668,847,135,7028,1,Debate matter discover present particularly only.,2024-12-14
2669,265,18,5680,5,Newspaper gun medical traditional.,2023-02-08
2670,49,270,5376,4,Two lay history owner high give business beyond.,2024-06-27
2671,597,158,9360,1,Thus hand economic sound expert maybe middle.,2024-05-17
2672,726,152,2534,1,Difficult plan student window truth.,2024-09-29
2673,54,423,9971,5,Respond dark tough money.,2024-08-12
2674,553,120,4110,5,Record huge politics space.,2024-02-22
2675,410,351,1743,5,View behavior school administration economy his.,2023-01-09
2676,1000,56,1072,1,Evening story notice item shake environment represent else.,2023-06-16
2677,821,372,9066,2,Create explain include billion any race parent.,2024-04-12
2678,713,198,8815,5,Top first professional look.,2023-07-27
2679,191,291,3926,5,Us owner successful memory enjoy from speak.,2023-12-07
2680,337,314,3926,3,Recognize which couple low gun personal generation.,2024-01-11
2681,31,484,7480,5,Mrs address save significant thing these little.,2024-10-27
2682,540,471,8721,2,Mother get former any contain past wind.,2023-01-29
2683,640,206,5588,2,Interview significant edge purpose fly fire.,2023-12-16
2684,432,367,4653,5,Decade Congress window look true avoid.,2024-02-07
2685,98,192,2591,5,Machine road reality enough any policy over.,2024-03-18
2686,550,15,5992,1,Performance scientist as opportunity either what next.,2023-06-06
2687,72,482,7790,4,Thus here a amount good win.,2024-03-27
2688,163,252,5975,2,Without quickly long ever.,2024-03-21
2689,245,419,4744,1,Baby detail audience live customer unit.,2024-02-13
2690,882,423,4341,5,One according attorney way as.,2024-06-23
2691,709,92,4239,3,Herself special clearly often item.,2023-04-12
2692,10,410,8505,4,Fish eat free past future.,2024-01-15
2693,145,159,8894,5,Star keep blood.,2024-10-15
2694,771,263,9559,5,Special professional moment really strategy.,2024-06-26
2695,379,443,8017,5,Husband get question treat.,2023-08-18
2696,738,230,5887,4,Head room direction drive thing room thus.,2024-11-15
2697,56,497,6660,3,Stage true production stuff magazine.,2024-07-11
2698,906,325,2124,2,Term country bank parent three.,2024-10-05
2699,388,244,3707,3,Good it fact could.,2023-01-10
