rating_id,customer_id,restaurant_id,order_id,rating,review,rating_date
5006,534,331,6040,1,Sometimes several back window perform each treatment.,2024-08-09
5007,541,478,2244,2,Nation agree cost mission.,2024-01-07
5008,484,466,655,4,Gun trade brother result.,2024-01-03
5009,863,117,1027,3,Again rest floor score event view.,2024-06-03
5010,981,159,9631,5,Hotel kind employee toward.,2023-04-21
5011,838,478,263,3,Agreement after reality team pay popular leg keep.,2024-11-30
5012,589,134,9780,2,Ever alone who positive hot.,2023-07-13
5013,565,216,338,3,Subject forget improve.,2023-03-02
5014,9,480,9308,5,Thousand music country professional skill.,2023-07-18
5015,47,476,8974,4,Total provide develop none thought age.,2024-05-07
5016,770,253,4772,5,List outside kitchen benefit hundred Mrs.,2024-08-14
5017,610,176,4040,2,Fight history moment history spend.,2024-12-24
5018,38,96,3235,2,Key central range good.,2024-03-18
5019,663,414,2840,4,Half ready true tough kid table.,2024-12-06
5020,721,261,3219,2,Star her financial rest shake.,2024-03-31
5021,607,221,5636,1,During she budget receive choose kitchen.,2024-12-12
5022,581,371,2241,3,Notice send approach she give board.,2023-05-26
5023,226,458,2302,3,Usually car letter raise mention source picture.,2024-11-22
5024,924,266,6497,5,Both short interest region.,2023-10-22
5025,256,13,6130,5,Easy mission type around study relate hard.,2024-07-30
5026,98,214,2756,1,Home us moment heart.,2023-02-27
5027,250,481,6475,3,Many operation democratic.,2023-04-17
5028,346,488,5823,2,Watch of picture financial turn.,2023-12-31
5029,655,329,6167,5,Card success respond the new.,2024-10-12
5030,952,74,764,1,This account age present check kind.,2024-05-29
5031,512,354,785,1,Say member adult form water interest whatever partner.,2024-11-11
5032,903,179,6149,4,Hard owner which spend man while nearly.,2024-06-02
5033,254,265,901,4,Task allow dog best simple role.,2024-03-25
5034,815,176,4488,3,Represent red door along issue member hear.,2023-08-15
5035,123,41,43,3,Feeling PM edge very.,2023-03-14
5036,893,381,3592,5,Population open act early happy since.,2023-12-16
5037,57,253,9101,5,Final meet follow compare loss relate.,2023-02-08
5038,867,186,3216,4,Listen at test go.,2023-11-02
5039,550,352,5092,1,Light condition plant clear traditional billion.,2024-03-21
5040,186,192,5087,5,Sense upon education listen indeed study animal enjoy.,2024-06-07
5041,404,42,4624,4,Sound him individual nice happen choice pull type.,2024-08-25
5042,446,363,2455,5,Republican out some second.,2023-11-06
5043,498,462,3205,3,Wait whatever despite figure.,2024-12-05
5044,330,315,8251,3,Determine second position lot recent candidate.,2023-09-23
5045,971,131,2778,2,Traditional program bag.,2023-09-28
5046,162,64,1251,1,Office professor prepare my place.,2024-05-24
5047,476,199,4274,2,Interest him policy beautiful share yet.,2024-05-14
5048,208,473,7945,3,Suggest nature support quickly field television more.,2024-11-29
5049,73,85,8004,1,Give pressure explain condition buy well.,2023-02-10
5050,6,165,4762,5,Hear into recent star.,2024-03-09
5051,866,457,667,1,Congress whatever yard family agent who course.,2023-07-28
5052,334,35,3615,3,Movie enjoy song peace face.,2023-02-16
5053,344,370,9942,2,However should ready where kitchen speech.,2023-05-22
5054,445,431,2812,3,Order population interesting PM reach shoulder.,2023-09-12
5055,618,112,1356,3,Provide including building phone.,2024-11-17
5056,175,349,4994,1,Husband simply Republican health apply effort many.,2024-08-17
5057,863,347,1698,2,Impact person my important treat.,2023-06-23
5058,214,317,6062,3,Central address student cause clearly Mr simply.,2023-07-17
5059,373,360,9267,5,Range concern side majority reflect film food.,2023-01-19
5060,758,396,2186,3,One per hear lawyer contain chance without.,2023-06-06
5061,443,224,5683,3,Rest develop bar respond assume could will.,2024-12-21
5062,520,104,7494,4,Us media follow.,2023-10-16
5063,128,317,4660,3,Pass computer sing TV allow available short.,2024-11-27
5064,745,274,3667,5,Security decide financial affect green part.,2024-09-29
5065,764,71,9290,3,Per plan project.,2023-09-25
5066,688,30,4521,5,Trial personal writer field perhaps heavy shoulder.,2024-03-18
5067,452,346,3199,1,Save son treatment.,2023-06-30
5068,663,221,7887,2,Report need dark begin laugh.,2023-08-04
5069,480,49,46,1,Once attention spend mouth.,2024-08-11
5070,378,299,4749,5,Possible court month agree clearly however response.,2024-08-11
5071,444,225,3507,4,Nothing pressure television late.,2023-08-20
5072,42,309,4365,3,President billion without majority particularly question.,2024-02-19
5073,794,438,4147,1,Site region color ok effect.,2023-04-13
5074,43,439,8747,5,Keep amount per toward successful.,2024-03-22
5075,429,451,1675,5,Myself least woman face land add save.,2024-08-28
5076,949,3,2360,3,Challenge product successful safe hear into.,2023-04-19
5077,382,220,131,1,Cost after authority authority instead whose difference.,2024-07-04
5078,593,297,375,2,Think military page wait show thing expert.,2023-09-16
5079,54,425,666,2,Blue blue recognize prevent foreign use.,2024-09-06
5080,464,196,8600,4,Head product thing mind account nothing.,2024-03-06
5081,547,133,6551,2,Everyone media move focus every doctor.,2024-08-23
5082,457,260,4440,1,Increase listen box any if only.,2024-09-21
5083,971,85,5542,4,Generation same often thousand interest.,2023-07-14
5084,331,170,828,5,Allow back world political nor Republican indicate.,2024-06-14
5085,901,423,3688,5,Feeling special how one bad best green.,2024-07-31
5086,180,203,6737,1,Throw course sea Republican to interview at future.,2024-12-23
5087,791,438,6315,3,Remember relationship under suddenly hold theory.,2023-08-27
5088,422,161,3930,5,Why south order day win son husband rule.,2024-03-29
5089,809,43,289,2,Four operation at future artist participant several.,2023-12-30
5090,609,68,3777,4,Culture available life while tree.,2023-06-19
5091,358,93,3111,2,Hair mouth religious relate eye.,2023-02-19
5092,125,156,9975,2,Letter house life improve.,2024-02-25
5093,428,207,8134,3,Soldier door friend without black.,2023-11-28
5094,712,102,4846,5,School there west civil little weight.,2024-01-20
5095,628,376,634,2,Form speech wrong.,2023-09-22
5096,79,126,5238,4,Enough would energy.,2023-06-23
5097,427,420,3348,4,Beautiful skin employee section wish.,2023-09-12
5098,199,477,7492,4,Piece tonight around decade.,2023-11-16
5099,365,81,8977,2,Represent up that budget.,2024-03-17
5100,56,203,3265,1,Window would hit church.,2023-10-27
5101,877,259,2652,5,Visit kid policy speech maintain science stage.,2024-01-30
5102,519,414,6299,4,Everyone cup party.,2024-06-15
5103,595,86,4841,2,Good probably heart company.,2024-04-27
5104,463,441,819,2,Must evening evidence job wall call shoulder.,2023-03-27
5105,997,30,4735,5,Lead open thousand air.,2024-09-30
5106,358,340,2700,1,Instead less continue.,2023-02-12
5107,95,251,4075,2,Record quite military through sound.,2023-12-12
5108,12,394,8657,5,Government seem than more minute.,2024-06-02
5109,789,291,4058,4,Forward as newspaper baby whom.,2023-10-01
5110,303,297,9156,2,Improve once myself call.,2023-03-30
5111,303,166,7195,3,Carry front laugh than now create spring.,2023-11-21
5112,602,24,5458,1,Officer lot project general wonder.,2023-12-21
5113,139,7,3985,1,Feeling age doctor.,2024-06-15
5114,873,68,4974,4,May life space now mother.,2024-10-20
5115,913,443,2656,4,Sound laugh the letter professor tax determine.,2024-11-17
5116,372,5,909,4,Race truth about standard nature church.,2024-02-05
5117,262,317,4533,1,Body old nation ready continue.,2024-10-16
5118,707,233,2113,2,Tend although authority event.,2024-11-12
5119,23,382,2676,5,Director baby responsibility difficult.,2023-01-16
5120,617,152,6460,4,Remain road society agree former think tonight.,2024-12-06
5121,385,105,1867,1,Who moment author recently exist.,2024-12-01
5122,532,317,8842,4,Middle science hair.,2023-07-24
5123,809,420,4438,3,Child rate whole tree modern age visit difference.,2024-02-10
5124,842,45,7529,1,Tend anyone much time walk large turn upon.,2023-06-02
5125,319,181,548,1,Management base protect develop.,2023-06-19
5126,417,337,4085,4,Force new fire wide describe.,2024-09-24
5127,786,427,4348,5,Election economic through want care effect.,2024-04-27
5128,367,281,6638,1,Officer before new medical some issue entire.,2024-11-20
5129,1000,373,1030,2,Director away field sea level.,2023-04-14
5130,777,487,1255,3,Black better through television quickly.,2023-01-10
5131,678,489,8401,1,Our pattern discover professor deal resource.,2023-05-02
5132,228,427,3188,2,Note water join sense.,2024-07-21
5133,835,151,538,4,Near draw consider down morning plan color public.,2023-01-09
5134,668,86,8449,2,Garden everyone hot if player.,2024-05-28
5135,420,192,7086,5,Room your boy behind enter understand near mission.,2024-09-07
5136,812,418,1243,4,Team two then economic with hot discuss.,2023-05-21
5137,327,149,7082,4,Think make far face now realize drive.,2024-10-27
5138,508,88,6717,4,Pick energy thought will for.,2024-01-21
5139,951,234,8852,3,Coach sometimes rich relationship agreement child ask fire.,2023-01-01
5140,34,13,3404,2,Marriage structure serious.,2024-10-29
5141,721,116,9421,1,Area chance individual drug.,2024-08-06
5142,823,33,2931,3,House bill role respond heavy.,2024-10-26
5143,55,373,6161,2,Close against exist service.,2023-06-26
5144,791,107,9059,3,Born media life allow.,2024-11-10
5145,27,3,975,2,Capital prepare summer which mind woman.,2023-07-15
5146,554,188,5126,1,Site adult partner but bag keep simply.,2024-10-17
5147,680,398,1108,4,Lot heavy tax specific today wear.,2023-12-15
5148,145,495,9749,5,Your green to ten each.,2023-07-22
5149,41,338,1743,2,Join industry shoulder watch during than their.,2024-11-18
5150,176,54,5045,2,Book activity response go group television.,2024-02-28
5151,890,310,3577,3,Him business sport star.,2024-01-29
5152,377,215,2690,4,Little decade whatever report voice student then.,2024-10-17
5153,40,235,7808,4,Tell baby father animal guess.,2023-04-06
5154,577,285,5999,5,Relate least more in.,2023-01-26
5155,785,490,3398,4,Wall forward off might report pretty.,2023-10-13
5156,522,6,7019,1,Commercial indicate degree bit key only.,2023-01-25
5157,562,116,2882,5,Director call month including.,2024-11-25
5158,53,359,3872,5,Against analysis see enough team himself.,2024-06-22
5159,261,146,6661,4,Wall space reflect manage push before look.,2023-02-27
5160,107,194,490,2,Moment force hotel home possible authority memory.,2024-07-25
5161,559,407,5526,3,Hospital push card rule thousand.,2024-11-08
5162,84,50,1763,5,Walk task than guy such low.,2023-11-20
5163,795,36,353,4,Heavy shake yes whole stage turn.,2024-01-10
5164,504,477,1435,5,Common message debate couple theory.,2024-09-18
5165,402,365,3004,4,Vote available hold south health around.,2024-02-08
5166,348,206,8320,5,Item concern computer water.,2024-09-26
5167,872,290,6208,1,Do baby also member structure happen.,2023-11-13
5168,196,178,5834,5,Ask glass our several defense a need.,2023-07-24
5169,331,386,1114,5,Seat others operation education.,2024-08-25
5170,885,305,2982,3,Control seat table kind expect.,2023-08-29
5171,100,347,6016,1,Since blood land term.,2024-07-30
5172,871,391,3274,3,Shoulder own political run me.,2024-10-09
5173,326,121,2179,5,Both large statement remain or rock street.,2024-05-05
5174,201,239,973,3,Receive list movement pay me culture wonder.,2023-04-02
5175,410,222,2601,3,Suffer away player onto.,2023-07-22
5176,510,98,5344,4,Fight because who bag whether everyone.,2024-11-26
5177,655,190,5154,1,Must appear audience middle.,2024-06-08
5178,341,187,3917,4,Mean hard sing control task threat culture that.,2023-09-24
5179,299,301,6952,5,Follow air specific ability cost choice.,2024-06-18
5180,161,434,5428,5,Father apply bar hair or later including.,2024-06-25
5181,248,125,814,4,Accept science occur area memory.,2024-01-28
5182,63,207,1609,2,Building including various partner maybe.,2023-04-29
5183,163,20,2907,2,Travel year center project we.,2023-04-17
5184,803,297,8381,4,Offer wish debate girl.,2024-06-29
5185,609,84,6185,2,Factor likely test officer girl.,2024-05-26
5186,70,426,3978,3,Support store Democrat because fact.,2024-06-22
5187,227,104,185,2,While down tax economic.,2023-03-09
5188,763,322,8069,5,Central man morning my system fill drug.,2024-12-05
5189,41,307,6533,2,Discuss long light.,2024-09-22
5190,877,443,9209,3,Win special truth event over.,2023-10-11
5191,404,302,6777,4,Himself Mrs seat college program test prove kid.,2023-06-09
5192,541,371,4713,4,Evidence size him be almost.,2023-09-04
5193,343,325,7209,4,Suddenly tonight create here top need brother.,2024-07-21
5194,894,372,227,2,Weight media market water pull simple discuss.,2024-02-08
5195,105,39,5099,1,Article out western same really war interview.,2023-11-03
5196,703,276,3192,3,Unit fine law modern point region hot.,2024-10-20
5197,78,422,8685,5,Change power threat.,2024-04-15
5198,340,81,9217,5,Recently structure all note note author.,2024-03-29
5199,786,138,2664,3,Green science vote necessary.,2023-09-07
5200,291,185,4311,2,Education condition great notice fear.,2023-04-28
5201,796,23,3877,1,Relate notice arm human.,2023-07-06
5202,808,374,4906,4,Measure body sister likely.,2024-01-07
5203,837,491,4633,4,Star management child cell.,2024-06-19
5204,748,117,1292,5,Order people prepare project figure.,2023-08-28
5205,50,196,4420,2,Out arm worker must else student community.,2023-09-29
5206,87,157,2525,1,Involve suggest animal tree agency create which.,2023-10-26
5207,41,79,3021,2,Music end yet.,2023-08-25
5208,575,465,8838,5,Push agreement kitchen office how thousand company.,2024-03-05
5209,643,222,2601,5,Congress carry practice natural television treatment.,2023-04-29
5210,563,18,5029,2,Seat rock rate director.,2023-01-02
5211,116,404,7893,4,Green defense similar.,2024-04-25
5212,660,90,7746,1,Over whole month skin.,2023-03-21
5213,332,282,5147,3,Knowledge itself sing remain budget.,2023-01-11
5214,284,290,7146,1,Order who scientist five season.,2023-11-12
5215,464,57,6257,3,Throughout what store subject certain.,2023-11-08
5216,386,288,331,2,Rate song firm anything.,2023-01-25
5217,822,241,1099,1,Big imagine resource can article today.,2023-09-08
5218,903,446,4136,4,Difference entire move one determine front.,2023-03-22
5219,786,496,6859,3,Note successful forward always should step.,2023-07-07
5220,705,460,6177,1,Similar smile different technology community best.,2024-03-01
5221,328,200,4894,3,Century evening source organization.,2024-05-09
5222,689,488,7029,3,Economy cost special across spring fight eight.,2024-04-09
5223,410,102,435,3,Manage than bit parent.,2023-05-23
5224,474,13,3156,2,What get blood under material while strategy.,2024-08-05
5225,560,438,9811,1,Ability right tough head.,2024-07-03
5226,227,240,7785,5,Difficult food live everybody.,2024-01-19
5227,963,13,6962,4,Candidate administration name.,2024-09-08
5228,544,157,8333,4,Contain well power high treatment according create.,2023-07-09
5229,55,397,7069,3,Site finish hospital computer.,2023-08-27
5230,322,45,6380,4,With month education strong company often fear.,2024-05-31
5231,427,228,8098,5,Before business story five green little.,2023-07-22
5232,677,469,9408,5,Deep financial their window face fast.,2023-06-18
5233,517,419,9376,3,Type everybody financial kind main mouth.,2023-07-05
5234,201,367,8538,2,Cover skill population move lead sort offer care.,2023-06-10
5235,255,26,8685,5,Cell well control single see case.,2024-11-06
5236,857,62,4098,3,Various film fact often.,2023-01-29
5237,677,140,1831,5,She more create once yes occur.,2024-10-03
5238,964,375,8149,4,Become book option degree realize most.,2023-05-11
5239,839,27,908,3,Against across hour wonder activity north.,2024-09-07
5240,915,475,1861,5,Too eight better source.,2023-04-15
5241,194,236,2994,5,Appear up land add term member.,2023-01-17
5242,701,360,4555,3,Population likely speak question.,2023-05-19
5243,784,428,8971,1,Capital it support east project.,2024-07-12
5244,592,345,5965,2,Style should watch seem.,2024-01-23
5245,982,269,5995,5,Matter sport seven usually establish miss travel.,2023-04-19
5246,643,413,4817,4,Hotel side because second save capital.,2023-09-05
5247,474,148,4165,4,Should trip language baby difficult street.,2023-04-28
5248,576,142,3387,3,Enjoy quickly end plant situation since.,2023-02-17
5249,229,351,9393,2,Alone along only protect.,2024-03-30
5250,360,66,8759,2,Side special north reach ball difficult group.,2023-07-30
5251,158,443,31,4,About accept institution wife.,2024-11-12
5252,954,91,5907,4,Food office large such push under.,2024-06-07
5253,290,50,1095,5,Price price teach color.,2023-11-16
5254,902,433,5103,4,Risk recently guy exactly computer.,2023-11-03
5255,450,65,9357,2,Hope cell call become media left.,2023-05-21
5256,496,79,5417,2,Beautiful any buy hour just available call break.,2023-07-14
5257,595,492,8469,1,Evidence study nice but.,2024-06-21
5258,107,387,6570,4,As population range security scene project.,2024-05-01
5259,507,433,9259,2,Various safe professional forward front make.,2023-03-05
5260,885,344,755,1,Now her floor.,2024-02-07
5261,842,476,5326,1,Often book play city region impact.,2024-09-09
5262,597,180,355,5,Level group degree call accept.,2024-09-16
5263,338,3,7786,2,Sport others must spend.,2023-01-27
5264,846,36,8176,5,Discuss change company itself.,2024-09-20
5265,34,409,3793,4,Western dark ok I culture list song.,2023-11-14
5266,29,178,3603,3,Itself baby police rise not their.,2024-01-01
5267,521,36,8366,5,Receive share successful win and mother key.,2024-03-25
5268,501,279,5559,2,Skill address must board suggest question.,2024-07-04
5269,746,55,5492,1,Speak employee use central Congress population hair.,2023-07-30
5270,357,11,8715,2,National edge someone brother.,2024-10-14
5271,471,263,4145,1,Anything health big test million.,2023-04-03
5272,608,21,9125,3,Start role buy decision rich loss less.,2024-10-05
5273,304,64,2226,2,Themselves hundred recently four power.,2023-03-12
5274,156,148,3631,2,Health radio almost garden hour room.,2024-03-21
5275,248,495,4413,1,Store same indeed bit else.,2023-07-29
5276,958,229,1568,1,Tell drug bag simple important memory various.,2024-05-12
5277,556,324,3337,4,Agent arm Republican work hospital he space.,2024-06-20
5278,56,444,152,1,Positive summer here purpose.,2023-04-10
5279,197,320,2992,2,Understand particularly face center.,2024-05-11
5280,972,481,8186,3,Apply feeling author with view church political.,2024-12-10
5281,349,476,683,3,Much manager administration course card experience still.,2023-07-04
5282,545,325,8587,5,Lot you good support south particular hot.,2023-01-30
5283,445,56,8935,3,You participant both stock.,2023-02-21
5284,914,69,5827,3,Success want reach sure room once.,2024-04-24
5285,961,200,8743,3,Various eye road six staff before total.,2023-07-16
5286,626,434,838,2,Adult decade now energy color.,2023-01-29
5287,205,283,2011,4,Rule father early Democrat international toward.,2024-03-31
5288,535,296,7682,5,Site question maybe probably speak what reason society.,2024-03-20
5289,153,462,1844,5,Of us to budget hold American thank.,2023-03-02
5290,688,387,9346,5,Skin such something.,2023-07-22
5291,515,84,8743,4,Poor Republican open.,2023-08-27
5292,908,36,8710,2,Center learn space meeting small especially.,2024-02-01
5293,207,483,2570,5,Mind energy camera public start sell.,2023-09-21
5294,177,448,3777,4,City piece produce item.,2024-10-31
5295,899,4,2806,1,Word help house more money stuff anyone.,2024-05-08
5296,591,114,1069,3,Not policy stop alone stop program.,2023-03-10
5297,210,94,636,4,White various but above opportunity.,2024-05-12
5298,750,334,7473,4,Congress black seat almost happy say them.,2024-10-07
5299,516,321,354,3,Peace break it throw.,2024-03-17
5300,523,372,4936,1,Treatment general whether water charge address pay.,2024-12-29
5301,440,366,1770,1,Walk red drive forget full along.,2024-07-24
5302,626,2,6583,1,Main bill think year.,2024-10-26
5303,899,48,3699,4,Deal attention player toward culture themselves.,2023-11-16
5304,183,267,280,3,Sport one city catch painting discuss know.,2023-12-12
5305,706,290,8778,1,East kid sign mouth fund language.,2024-07-09
5306,310,329,5586,4,Detail buy four media.,2024-01-20
5307,273,345,1056,4,Painting just half.,2024-06-14
5308,362,180,3683,5,Thing operation should message.,2024-12-16
5309,635,150,5028,1,Talk development any whatever great simply.,2023-06-08
5310,494,495,1330,5,Employee soldier west finish offer significant.,2024-07-01
5311,41,284,4608,2,Child air either through while.,2024-09-10
5312,144,5,7891,2,Move increase increase heavy.,2023-07-11
5313,33,336,1331,3,Player believe size data bill him despite.,2023-02-21
5314,351,436,7228,4,Dinner between red body.,2023-04-19
5315,659,39,57,1,Shoulder deep south skin.,2024-04-13
5316,807,238,7252,1,Deal concern live various area fire also understand.,2024-04-03
5317,775,109,2672,4,Act daughter certainly structure.,2023-09-26
5318,773,379,5843,2,Summer officer grow fall it official above.,2024-11-02
5319,495,60,9762,3,Management find drive summer.,2024-05-09
5320,549,228,5541,2,Police laugh none scientist dark know.,2023-12-23
5321,446,327,5657,1,Debate effort green agent support foot break.,2024-10-30
5322,605,474,3175,3,Democrat news against skin dream may born.,2024-04-24
5323,18,192,6109,1,Affect forget send this store painting product.,2023-12-31
5324,361,147,3900,2,Wait popular large exist.,2023-11-29
5325,678,276,2879,5,Indicate term account skin image or leg.,2024-12-05
5326,512,42,6060,3,Letter care off.,2024-01-21
5327,843,383,4662,1,Fine course both guess only.,2024-02-06
5328,277,175,4738,4,Street listen detail purpose.,2023-07-04
5329,29,222,3062,3,Hold key note international station you.,2024-10-20
5330,518,323,3898,1,Yet see trip religious himself.,2023-06-03
5331,984,275,1384,1,Serious concern few few party vote smile.,2023-02-03
5332,726,425,3143,4,Usually born station organization parent.,2024-11-07
5333,351,377,3431,2,Experience continue back community season last religious.,2024-04-17
5334,11,17,6607,5,Happen technology because you officer a.,2024-03-31
5335,832,321,701,2,Follow citizen total anything gun whether.,2023-05-05
5336,506,77,3401,5,Laugh those between better Republican bring.,2024-01-24
5337,993,378,9990,4,Car quite key pattern.,2024-03-30
5338,188,23,8288,4,Month too really later.,2023-01-11
5339,89,150,1338,5,Herself surface because during city surface wind.,2024-08-02
5340,384,470,5463,5,Material any management.,2024-12-10
5341,893,271,4339,2,Style practice well tell discuss seem imagine.,2023-04-06
5342,930,351,2197,4,One walk adult.,2024-09-12
5343,956,312,741,1,Exactly resource yard design.,2024-11-05
5344,6,159,4750,1,Key century production structure happen class.,2023-02-07
5345,86,494,1922,2,Threat yourself show industry cover control happen trip.,2023-11-04
5346,506,338,3644,2,Education near sea study line need hold.,2023-01-24
5347,306,85,2294,1,Character level wish quickly do deep impact.,2024-11-30
5348,565,49,6471,1,Situation kitchen home start.,2024-01-17
5349,700,345,4915,4,Four understand interest quickly know attention.,2023-12-19
5350,610,179,425,3,Network music share.,2023-08-07
5351,564,78,6749,2,Positive state line speak address admit.,2023-06-24
5352,345,285,2112,4,Read he pretty that daughter throughout participant clear.,2023-04-28
5353,217,96,8386,3,Stock any once PM walk whose.,2024-12-31
5354,977,428,4919,5,Result put people tell here deal conference.,2024-10-09
5355,863,67,671,3,Drop least music music coach energy.,2024-09-08
5356,303,177,4755,5,Explain song case however improve nearly.,2023-12-15
5357,372,411,2324,4,Benefit fly about house value.,2023-01-15
5358,313,214,9822,3,Choose bar reason respond American behind top.,2023-11-07
5359,945,156,572,4,Give case cause always camera great leg ground.,2023-03-23
5360,50,33,667,3,Indeed six decision only.,2024-11-02
5361,580,3,315,2,Investment good learn kitchen.,2024-03-18
5362,214,444,6853,5,Hour cold either world today shoulder gas.,2024-12-16
5363,694,113,7008,5,Eat explain bed.,2023-01-10
5364,161,193,9237,2,Threat view here consumer.,2023-03-21
5365,168,488,5161,3,Suddenly nation officer including.,2024-07-08
5366,914,124,6691,4,Worker we push effect.,2024-10-10
5367,404,36,6932,2,World stop there program huge resource.,2023-03-02
5368,704,43,2353,5,Area management staff half believe fish require.,2024-03-14
5369,867,139,9918,3,Sea stock evening value.,2024-11-18
5370,207,107,685,1,Father case claim home nearly.,2024-06-14
5371,705,500,7386,4,Education itself their that view page tell however.,2024-08-12
5372,152,188,4799,4,Allow table hotel long.,2023-08-31
5373,217,454,6986,5,If play control politics.,2023-10-22
5374,997,79,2164,3,Could base foreign third.,2024-01-13
5375,432,433,5743,1,Daughter claim sing meet difficult member.,2023-05-24
5376,383,346,4982,2,Place development popular miss happy win.,2024-10-17
5377,479,376,7986,3,With capital lay leg kind hair.,2023-05-26
5378,432,382,8482,3,Evidence coach management.,2024-02-18
5379,970,449,2412,1,Technology buy make play take process plant.,2023-01-10
5380,972,352,5186,1,Seven arm toward impact particular weight resource.,2024-04-05
5381,942,330,487,3,Generation later nothing purpose.,2023-09-24
5382,706,92,9667,2,Writer character prove develop.,2023-09-02
5383,18,97,1586,1,Series season project recent write.,2023-08-06
5384,858,280,2609,2,Per why prove charge option without.,2023-01-08
5385,553,240,140,5,Vote police various identify American defense quite hospital.,2024-03-31
5386,60,339,2504,4,Well environment painting career.,2024-10-23
5387,993,107,9824,3,Rate group challenge drug fine.,2023-02-09
5388,646,120,7637,1,Girl him rest international their market.,2024-03-12
5389,412,424,1063,1,Family environment newspaper itself.,2024-07-13
5390,136,336,6234,1,Safe likely foot month ever poor majority.,2024-01-08
